occurrrenceID,eventDataControle,eventData,day,month,year,eventDate,waterBody,locality,X,Y,vernacularName,vernacularNameGBIF,verName,scientificName2,scientificName,lifeStage,lenght,weight,individualCount,dataSet,samplingProtocol,Mesohabitat,habitat
INBO:AQ:1,2/09/2014,2/09/2014,02,09,2014,2014-09-02,Kanaal Brussel-Schelde,RO Grimbergen zone 2,152073.166,184314.048,brasem,Brasem,,"Abramis brama (Linnaeus, 1758)","Abramis brama (Linnaeus, 1758)", ,222,,1,NTMBZeekanaal,schietfuiken,NTMB,afkalvende oever
INBO:AQ:2,2/09/2014,2/09/2014,02,09,2014,2014-09-02,Kanaal Brussel-Schelde,RO Grimbergen zone 2,152073.166,184314.048,brasem,Brasem,,"Abramis brama (Linnaeus, 1758)","Abramis brama (Linnaeus, 1758)", ,236,,1,NTMBZeekanaal,schietfuiken,NTMB,afkalvende oever
INBO:AQ:3,2/09/2014,2/09/2014,02,09,2014,2014-09-02,Kanaal Brussel-Schelde,LO Grimbergen zone 4b_B,152257.821,183714.713,brasem,Brasem,,"Abramis brama (Linnaeus, 1758)","Abramis brama (Linnaeus, 1758)", ,83,,1,NTMBZeekanaal,schietfuiken,NTMB,breuksteen
INBO:AQ:4,2/09/2014,2/09/2014,02,09,2014,2014-09-02,Kanaal Brussel-Schelde,LO Grimbergen zone 4b_B,152257.821,183714.713,brasem,Brasem,,"Abramis brama (Linnaeus, 1758)","Abramis brama (Linnaeus, 1758)", ,84,,1,NTMBZeekanaal,schietfuiken,NTMB,breuksteen
INBO:AQ:5,2/09/2014,2/09/2014,02,09,2014,2014-09-02,Kanaal Brussel-Schelde,LO Grimbergen zone 4b_B,152257.821,183714.713,brasem,Brasem,,"Abramis brama (Linnaeus, 1758)","Abramis brama (Linnaeus, 1758)", ,85,,2,NTMBZeekanaal,schietfuiken,NTMB,breuksteen
INBO:AQ:6,2/09/2014,2/09/2014,02,09,2014,2014-09-02,Kanaal Brussel-Schelde,LO Grimbergen zone 4b_B,152257.821,183714.713,brasem,Brasem,,"Abramis brama (Linnaeus, 1758)","Abramis brama (Linnaeus, 1758)", ,87,,1,NTMBZeekanaal,schietfuiken,NTMB,breuksteen
INBO:AQ:7,2/09/2014,2/09/2014,02,09,2014,2014-09-02,Kanaal Brussel-Schelde,LO Grimbergen zone 4b_B,152257.821,183714.713,brasem,Brasem,,"Abramis brama (Linnaeus, 1758)","Abramis brama (Linnaeus, 1758)", ,89,,2,NTMBZeekanaal,schietfuiken,NTMB,breuksteen
INBO:AQ:8,2/09/2014,2/09/2014,02,09,2014,2014-09-02,Kanaal Brussel-Schelde,LO Grimbergen zone 4b_B,152257.821,183714.713,brasem,Brasem,,"Abramis brama (Linnaeus, 1758)","Abramis brama (Linnaeus, 1758)", ,100,,1,NTMBZeekanaal,schietfuiken,NTMB,breuksteen
INBO:AQ:9,2/09/2014,2/09/2014,02,09,2014,2014-09-02,Kanaal Brussel-Schelde,LO Grimbergen zone 4a,152143.521,183945.43,brasem,Brasem,,"Abramis brama (Linnaeus, 1758)","Abramis brama (Linnaeus, 1758)", ,90,,1,NTMBZeekanaal,schietfuiken,NTMB,breuksteen
INBO:AQ:10,22/07/2014,22/07/2014,22,07,2014,2014-07-22,Kanaal Brussel-Schelde,LO Grimbergen 4a,151933.97,184364.531,alver,Alver,,"Alburnus alburnus (Linnaeus, 1758)","Alburnus alburnus (Linnaeus, 1758)", ,24,,1,NTMBZeekanaal,elektrische bevissing,NTMB,houtige begroeiing
INBO:AQ:11,22/07/2014,22/07/2014,22,07,2014,2014-07-22,Kanaal Brussel-Schelde,LO Grimbergen 4a,151933.97,184364.531,alver,Alver,,"Alburnus alburnus (Linnaeus, 1758)","Alburnus alburnus (Linnaeus, 1758)", ,33,,1,NTMBZeekanaal,elektrische bevissing,NTMB,houtige begroeiing
INBO:AQ:12,23/07/2014,23/07/2014,23,07,2014,2014-07-23,Kanaal Brussel-Schelde,RO Wintam zone 3,145322.009,200218.122,alver,Alver,,"Alburnus alburnus (Linnaeus, 1758)","Alburnus alburnus (Linnaeus, 1758)", ,60,,1,NTMBZeekanaal,elektrische bevissing,NTMB,moerasvegetaties
INBO:AQ:13,23/06/2014,23/06/2014,23,06,2014,2014-06-23,Kanaal Brussel-Schelde,RO Grimbergen,151952.138,184548.152,paling,Aal,,"Anguilla anguilla (Linnaeus, 1758)","Epilachna paling Yu, 2001", ,150,,9,NTMBZeekanaal,elektrische bevissing,VVO,schanskorven
INBO:AQ:14,24/06/2014,24/06/2014,24,06,2014,2014-06-24,Kanaal Brussel-Schelde,RO Wintam zone 2,145327.264,200389.792,paling,Aal,,"Anguilla anguilla (Linnaeus, 1758)","Epilachna paling Yu, 2001", ,80,,1,NTMBZeekanaal,elektrische bevissing,NTMB,moerasvegetaties
INBO:AQ:15,24/06/2014,24/06/2014,24,06,2014,2014-06-24,Kanaal Brussel-Schelde,RO Wintam zone 3,145322.009,200218.122,paling,Aal,,"Anguilla anguilla (Linnaeus, 1758)","Epilachna paling Yu, 2001", ,200,,1,NTMBZeekanaal,elektrische bevissing,NTMB,moerasvegetaties
INBO:AQ:16,22/07/2014,22/07/2014,22,07,2014,2014-07-22,Kanaal Brussel-Schelde,RO Grimbergen,151952.138,184548.152,paling,Aal,,"Anguilla anguilla (Linnaeus, 1758)","Epilachna paling Yu, 2001", ,100,,4,NTMBZeekanaal,elektrische bevissing,VVO,schanskorven
INBO:AQ:17,22/07/2014,22/07/2014,22,07,2014,2014-07-22,Kanaal Brussel-Schelde,RO Grimbergen,151952.138,184548.152,paling,Aal,,"Anguilla anguilla (Linnaeus, 1758)","Epilachna paling Yu, 2001", ,120,,1,NTMBZeekanaal,elektrische bevissing,VVO,schanskorven
INBO:AQ:18,22/07/2014,22/07/2014,22,07,2014,2014-07-22,Kanaal Brussel-Schelde,RO Grimbergen,151952.138,184548.152,paling,Aal,,"Anguilla anguilla (Linnaeus, 1758)","Epilachna paling Yu, 2001", ,150,,1,NTMBZeekanaal,elektrische bevissing,VVO,schanskorven
INBO:AQ:19,22/07/2014,22/07/2014,22,07,2014,2014-07-22,Kanaal Brussel-Schelde,RO Grimbergen,151952.138,184548.152,paling,Aal,,"Anguilla anguilla (Linnaeus, 1758)","Epilachna paling Yu, 2001", ,200,,1,NTMBZeekanaal,elektrische bevissing,VVO,schanskorven
INBO:AQ:20,22/07/2014,22/07/2014,22,07,2014,2014-07-22,Kanaal Brussel-Schelde,RO Grimbergen,151952.138,184548.152,paling,Aal,,"Anguilla anguilla (Linnaeus, 1758)","Epilachna paling Yu, 2001", ,300,,1,NTMBZeekanaal,elektrische bevissing,VVO,schanskorven
INBO:AQ:21,22/07/2014,22/07/2014,22,07,2014,2014-07-22,Kanaal Brussel-Schelde,RO Grimbergen,151952.138,184548.152,paling,Aal,,"Anguilla anguilla (Linnaeus, 1758)","Epilachna paling Yu, 2001", ,600,,1,NTMBZeekanaal,elektrische bevissing,VVO,schanskorven
INBO:AQ:22,22/07/2014,22/07/2014,22,07,2014,2014-07-22,Kanaal Brussel-Schelde,LO Grimbergen 4a,152143.521,183945.43,paling,Aal,,"Anguilla anguilla (Linnaeus, 1758)","Epilachna paling Yu, 2001", ,100,,1,NTMBZeekanaal,elektrische bevissing,NTMB,breuksteen
INBO:AQ:23,23/07/2014,23/07/2014,23,07,2014,2014-07-23,Kanaal Brussel-Schelde,RO Wintam zone 1,145583.319,200539.564,paling,Aal,,"Anguilla anguilla (Linnaeus, 1758)","Epilachna paling Yu, 2001", ,100,,2,NTMBZeekanaal,elektrische bevissing,NTMB,moerasvegetaties
INBO:AQ:24,23/07/2014,23/07/2014,23,07,2014,2014-07-23,Kanaal Brussel-Schelde,RO Wintam zone 3,145322.009,200218.122,paling,Aal,,"Anguilla anguilla (Linnaeus, 1758)","Epilachna paling Yu, 2001", ,450,,1,NTMBZeekanaal,elektrische bevissing,NTMB,moerasvegetaties
INBO:AQ:25,23/07/2014,23/07/2014,23,07,2014,2014-07-23,Kanaal Brussel-Schelde,RO Wintam,145328.14,200090.246,paling,Aal,,"Anguilla anguilla (Linnaeus, 1758)","Epilachna paling Yu, 2001", ,190,,1,NTMBZeekanaal,elektrische bevissing,NTMB,riet
INBO:AQ:26,1/09/2014,1/09/2014,01,09,2014,2014-09-01,Kanaal Brussel-Schelde,LO Grimbergen,151843.59,184560.438,paling,Aal,,"Anguilla anguilla (Linnaeus, 1758)","Epilachna paling Yu, 2001", ,580,,1,NTMBZeekanaal,elektrische bevissing,VVO,betonnen kopbalk
INBO:AQ:27,3/09/2014,3/09/2014,03,09,2014,2014-09-03,Kanaal Brussel-Schelde,RO Wintam zone 1,145583.319,200539.564,paling,Aal,,"Anguilla anguilla (Linnaeus, 1758)","Epilachna paling Yu, 2001", ,237,,1,NTMBZeekanaal,elektrische bevissing,NTMB,breuksteen
INBO:AQ:28,3/09/2014,3/09/2014,03,09,2014,2014-09-03,Kanaal Brussel-Schelde,RO Wintam zone 3,145322.009,200218.122,paling,Aal,,"Anguilla anguilla (Linnaeus, 1758)","Epilachna paling Yu, 2001", ,74,,1,NTMBZeekanaal,elektrische bevissing,NTMB,breuksteen
INBO:AQ:29,3/09/2014,3/09/2014,03,09,2014,2014-09-03,Kanaal Brussel-Schelde,RO Wintam zone 3,145322.009,200218.122,paling,Aal,,"Anguilla anguilla (Linnaeus, 1758)","Epilachna paling Yu, 2001", ,118,,1,NTMBZeekanaal,elektrische bevissing,NTMB,breuksteen
INBO:AQ:30,4/09/2014,4/09/2014,04,09,2014,2014-09-04,Kanaal Brussel-Schelde,LO Lot,142617.889,161353.806,paling,Aal,,"Anguilla anguilla (Linnaeus, 1758)","Epilachna paling Yu, 2001", ,135,,1,NTMBZeekanaal,elektrische bevissing,VVO,schanskorven
INBO:AQ:31,2/09/2014,2/09/2014,02,09,2014,2014-09-02,Kanaal Brussel-Schelde,RO Grimbergen,151952.138,184548.152,paling,Aal,,"Anguilla anguilla (Linnaeus, 1758)","Epilachna paling Yu, 2001", ,464,,1,NTMBZeekanaal,schietfuiken,VVO,schanskorven
INBO:AQ:32,2/09/2014,2/09/2014,02,09,2014,2014-09-02,Kanaal Brussel-Schelde,RO Grimbergen,151952.138,184548.152,paling,Aal,,"Anguilla anguilla (Linnaeus, 1758)","Epilachna paling Yu, 2001", ,477,,1,NTMBZeekanaal,schietfuiken,VVO,schanskorven
INBO:AQ:33,2/09/2014,2/09/2014,02,09,2014,2014-09-02,Kanaal Brussel-Schelde,RO Grimbergen,151952.138,184548.152,paling,Aal,,"Anguilla anguilla (Linnaeus, 1758)","Epilachna paling Yu, 2001", ,520,,1,NTMBZeekanaal,schietfuiken,VVO,schanskorven
INBO:AQ:34,2/09/2014,2/09/2014,02,09,2014,2014-09-02,Kanaal Brussel-Schelde,RO Grimbergen,151952.138,184548.152,paling,Aal,,"Anguilla anguilla (Linnaeus, 1758)","Epilachna paling Yu, 2001", ,540,,1,NTMBZeekanaal,schietfuiken,VVO,schanskorven
INBO:AQ:35,2/09/2014,2/09/2014,02,09,2014,2014-09-02,Kanaal Brussel-Schelde,RO Grimbergen,151952.138,184548.152,paling,Aal,,"Anguilla anguilla (Linnaeus, 1758)","Epilachna paling Yu, 2001", ,550,,1,NTMBZeekanaal,schietfuiken,VVO,schanskorven
INBO:AQ:36,2/09/2014,2/09/2014,02,09,2014,2014-09-02,Kanaal Brussel-Schelde,RO Grimbergen,151952.138,184548.152,paling,Aal,,"Anguilla anguilla (Linnaeus, 1758)","Epilachna paling Yu, 2001", ,614,,1,NTMBZeekanaal,schietfuiken,VVO,schanskorven
INBO:AQ:37,2/09/2014,2/09/2014,02,09,2014,2014-09-02,Kanaal Brussel-Schelde,RO Grimbergen,151952.138,184548.152,paling,Aal,,"Anguilla anguilla (Linnaeus, 1758)","Epilachna paling Yu, 2001", ,662,,1,NTMBZeekanaal,schietfuiken,VVO,schanskorven
INBO:AQ:38,2/09/2014,2/09/2014,02,09,2014,2014-09-02,Kanaal Brussel-Schelde,RO Grimbergen,151952.138,184548.152,paling,Aal,,"Anguilla anguilla (Linnaeus, 1758)","Epilachna paling Yu, 2001", ,755,,1,NTMBZeekanaal,schietfuiken,VVO,schanskorven
INBO:AQ:39,2/09/2014,2/09/2014,02,09,2014,2014-09-02,Kanaal Brussel-Schelde,RO Grimbergen zone 1,152032.155,184397.392,paling,Aal,,"Anguilla anguilla (Linnaeus, 1758)","Epilachna paling Yu, 2001", ,504,,1,NTMBZeekanaal,schietfuiken,NTMB,houtige begroeiing
INBO:AQ:40,2/09/2014,2/09/2014,02,09,2014,2014-09-02,Kanaal Brussel-Schelde,RO Grimbergen zone 1,152032.155,184397.392,paling,Aal,,"Anguilla anguilla (Linnaeus, 1758)","Epilachna paling Yu, 2001", ,640,,1,NTMBZeekanaal,schietfuiken,NTMB,houtige begroeiing
INBO:AQ:41,2/09/2014,2/09/2014,02,09,2014,2014-09-02,Kanaal Brussel-Schelde,RO Grimbergen zone 1,152032.155,184397.392,paling,Aal,,"Anguilla anguilla (Linnaeus, 1758)","Epilachna paling Yu, 2001", ,666,,1,NTMBZeekanaal,schietfuiken,NTMB,houtige begroeiing
INBO:AQ:42,2/09/2014,2/09/2014,02,09,2014,2014-09-02,Kanaal Brussel-Schelde,RO Grimbergen zone 1,152032.155,184397.392,paling,Aal,,"Anguilla anguilla (Linnaeus, 1758)","Epilachna paling Yu, 2001", ,678,,1,NTMBZeekanaal,schietfuiken,NTMB,houtige begroeiing
INBO:AQ:43,2/09/2014,2/09/2014,02,09,2014,2014-09-02,Kanaal Brussel-Schelde,RO Grimbergen zone 1,152032.155,184397.392,paling,Aal,,"Anguilla anguilla (Linnaeus, 1758)","Epilachna paling Yu, 2001", ,680,,1,NTMBZeekanaal,schietfuiken,NTMB,houtige begroeiing
INBO:AQ:44,2/09/2014,2/09/2014,02,09,2014,2014-09-02,Kanaal Brussel-Schelde,RO Grimbergen zone 2,152073.166,184314.048,paling,Aal,,"Anguilla anguilla (Linnaeus, 1758)","Epilachna paling Yu, 2001", ,315,,1,NTMBZeekanaal,schietfuiken,NTMB,afkalvende oever
INBO:AQ:45,2/09/2014,2/09/2014,02,09,2014,2014-09-02,Kanaal Brussel-Schelde,RO Grimbergen zone 2,152073.166,184314.048,paling,Aal,,"Anguilla anguilla (Linnaeus, 1758)","Epilachna paling Yu, 2001", ,413,,1,NTMBZeekanaal,schietfuiken,NTMB,afkalvende oever
INBO:AQ:46,2/09/2014,2/09/2014,02,09,2014,2014-09-02,Kanaal Brussel-Schelde,RO Grimbergen zone 2,152073.166,184314.048,paling,Aal,,"Anguilla anguilla (Linnaeus, 1758)","Epilachna paling Yu, 2001", ,505,,1,NTMBZeekanaal,schietfuiken,NTMB,afkalvende oever
INBO:AQ:47,2/09/2014,2/09/2014,02,09,2014,2014-09-02,Kanaal Brussel-Schelde,RO Grimbergen zone 2,152073.166,184314.048,paling,Aal,,"Anguilla anguilla (Linnaeus, 1758)","Epilachna paling Yu, 2001", ,530,,1,NTMBZeekanaal,schietfuiken,NTMB,afkalvende oever
INBO:AQ:48,2/09/2014,2/09/2014,02,09,2014,2014-09-02,Kanaal Brussel-Schelde,RO Grimbergen zone 2,152073.166,184314.048,paling,Aal,,"Anguilla anguilla (Linnaeus, 1758)","Epilachna paling Yu, 2001", ,532,,1,NTMBZeekanaal,schietfuiken,NTMB,afkalvende oever
INBO:AQ:49,2/09/2014,2/09/2014,02,09,2014,2014-09-02,Kanaal Brussel-Schelde,RO Grimbergen zone 2,152073.166,184314.048,paling,Aal,,"Anguilla anguilla (Linnaeus, 1758)","Epilachna paling Yu, 2001", ,595,,1,NTMBZeekanaal,schietfuiken,NTMB,afkalvende oever
INBO:AQ:50,2/09/2014,2/09/2014,02,09,2014,2014-09-02,Kanaal Brussel-Schelde,RO Grimbergen zone 2,152073.166,184314.048,paling,Aal,,"Anguilla anguilla (Linnaeus, 1758)","Epilachna paling Yu, 2001", ,695,,1,NTMBZeekanaal,schietfuiken,NTMB,afkalvende oever
INBO:AQ:51,2/09/2014,2/09/2014,02,09,2014,2014-09-02,Kanaal Brussel-Schelde,RO Grimbergen zone 2,152073.166,184314.048,paling,Aal,,"Anguilla anguilla (Linnaeus, 1758)","Epilachna paling Yu, 2001", ,752,,1,NTMBZeekanaal,schietfuiken,NTMB,afkalvende oever
INBO:AQ:52,2/09/2014,2/09/2014,02,09,2014,2014-09-02,Kanaal Brussel-Schelde,LO Grimbergen zone 4b_A,152539.338,183111.462,paling,Aal,,"Anguilla anguilla (Linnaeus, 1758)","Epilachna paling Yu, 2001", ,602,,1,NTMBZeekanaal,schietfuiken,NTMB,breuksteen
INBO:AQ:53,2/09/2014,2/09/2014,02,09,2014,2014-09-02,Kanaal Brussel-Schelde,LO Grimbergen zone 4b_A,152539.338,183111.462,paling,Aal,,"Anguilla anguilla (Linnaeus, 1758)","Epilachna paling Yu, 2001", ,662,,1,NTMBZeekanaal,schietfuiken,NTMB,breuksteen
INBO:AQ:54,2/09/2014,2/09/2014,02,09,2014,2014-09-02,Kanaal Brussel-Schelde,LO Grimbergen zone 4b_A,152539.338,183111.462,paling,Aal,,"Anguilla anguilla (Linnaeus, 1758)","Epilachna paling Yu, 2001", ,700,,1,NTMBZeekanaal,schietfuiken,NTMB,breuksteen
INBO:AQ:55,2/09/2014,2/09/2014,02,09,2014,2014-09-02,Kanaal Brussel-Schelde,LO Grimbergen zone 4b_B,152257.821,183714.713,paling,Aal,,"Anguilla anguilla (Linnaeus, 1758)","Epilachna paling Yu, 2001", ,408,,1,NTMBZeekanaal,schietfuiken,NTMB,breuksteen
INBO:AQ:56,2/09/2014,2/09/2014,02,09,2014,2014-09-02,Kanaal Brussel-Schelde,LO Grimbergen zone 4b_B,152257.821,183714.713,paling,Aal,,"Anguilla anguilla (Linnaeus, 1758)","Epilachna paling Yu, 2001", ,524,,1,NTMBZeekanaal,schietfuiken,NTMB,breuksteen
INBO:AQ:57,2/09/2014,2/09/2014,02,09,2014,2014-09-02,Kanaal Brussel-Schelde,LO Grimbergen zone 4b_B,152257.821,183714.713,paling,Aal,,"Anguilla anguilla (Linnaeus, 1758)","Epilachna paling Yu, 2001", ,585,,1,NTMBZeekanaal,schietfuiken,NTMB,breuksteen
INBO:AQ:58,2/09/2014,2/09/2014,02,09,2014,2014-09-02,Kanaal Brussel-Schelde,LO Grimbergen zone 4b_B,152257.821,183714.713,paling,Aal,,"Anguilla anguilla (Linnaeus, 1758)","Epilachna paling Yu, 2001", ,629,,1,NTMBZeekanaal,schietfuiken,NTMB,breuksteen
INBO:AQ:59,2/09/2014,2/09/2014,02,09,2014,2014-09-02,Kanaal Brussel-Schelde,LO Grimbergen zone 4b_B,152257.821,183714.713,paling,Aal,,"Anguilla anguilla (Linnaeus, 1758)","Epilachna paling Yu, 2001", ,641,,1,NTMBZeekanaal,schietfuiken,NTMB,breuksteen
INBO:AQ:60,2/09/2014,2/09/2014,02,09,2014,2014-09-02,Kanaal Brussel-Schelde,LO Grimbergen zone 4b_B,152257.821,183714.713,paling,Aal,,"Anguilla anguilla (Linnaeus, 1758)","Epilachna paling Yu, 2001", ,648,,1,NTMBZeekanaal,schietfuiken,NTMB,breuksteen
INBO:AQ:61,2/09/2014,2/09/2014,02,09,2014,2014-09-02,Kanaal Brussel-Schelde,LO Grimbergen zone 4a,152143.521,183945.43,paling,Aal,,"Anguilla anguilla (Linnaeus, 1758)","Epilachna paling Yu, 2001", ,128,,1,NTMBZeekanaal,schietfuiken,NTMB,breuksteen
INBO:AQ:62,2/09/2014,2/09/2014,02,09,2014,2014-09-02,Kanaal Brussel-Schelde,LO Grimbergen zone 4a,152143.521,183945.43,paling,Aal,,"Anguilla anguilla (Linnaeus, 1758)","Epilachna paling Yu, 2001", ,350,,1,NTMBZeekanaal,schietfuiken,NTMB,breuksteen
INBO:AQ:63,2/09/2014,2/09/2014,02,09,2014,2014-09-02,Kanaal Brussel-Schelde,LO Grimbergen zone 4a,152143.521,183945.43,paling,Aal,,"Anguilla anguilla (Linnaeus, 1758)","Epilachna paling Yu, 2001", ,546,,1,NTMBZeekanaal,schietfuiken,NTMB,breuksteen
INBO:AQ:64,2/09/2014,2/09/2014,02,09,2014,2014-09-02,Kanaal Brussel-Schelde,LO Grimbergen zone 4a,152143.521,183945.43,paling,Aal,,"Anguilla anguilla (Linnaeus, 1758)","Epilachna paling Yu, 2001", ,562,,1,NTMBZeekanaal,schietfuiken,NTMB,breuksteen
INBO:AQ:65,2/09/2014,2/09/2014,02,09,2014,2014-09-02,Kanaal Brussel-Schelde,LO Grimbergen zone 4a,152143.521,183945.43,paling,Aal,,"Anguilla anguilla (Linnaeus, 1758)","Epilachna paling Yu, 2001", ,650,,1,NTMBZeekanaal,schietfuiken,NTMB,breuksteen
INBO:AQ:66,4/09/2014,4/09/2014,04,09,2014,2014-09-04,Kanaal Brussel-Schelde,RO Wintam,143396.457,199875.659,paling,Aal,,"Anguilla anguilla (Linnaeus, 1758)","Epilachna paling Yu, 2001", ,325,,1,NTMBZeekanaal,schietfuiken,VVO,betonnen kopbalk
INBO:AQ:67,4/09/2014,4/09/2014,04,09,2014,2014-09-04,Kanaal Brussel-Schelde,RO Wintam,143396.457,199875.659,paling,Aal,,"Anguilla anguilla (Linnaeus, 1758)","Epilachna paling Yu, 2001", ,340,,1,NTMBZeekanaal,schietfuiken,VVO,betonnen kopbalk
INBO:AQ:68,4/09/2014,4/09/2014,04,09,2014,2014-09-04,Kanaal Brussel-Schelde,RO Wintam,143396.457,199875.659,paling,Aal,,"Anguilla anguilla (Linnaeus, 1758)","Epilachna paling Yu, 2001", ,404,,1,NTMBZeekanaal,schietfuiken,VVO,betonnen kopbalk
INBO:AQ:69,4/09/2014,4/09/2014,04,09,2014,2014-09-04,Kanaal Brussel-Schelde,RO Wintam,143396.457,199875.659,paling,Aal,,"Anguilla anguilla (Linnaeus, 1758)","Epilachna paling Yu, 2001", ,465,,1,NTMBZeekanaal,schietfuiken,VVO,betonnen kopbalk
INBO:AQ:70,4/09/2014,4/09/2014,04,09,2014,2014-09-04,Kanaal Brussel-Schelde,RO Wintam,143396.457,199875.659,paling,Aal,,"Anguilla anguilla (Linnaeus, 1758)","Epilachna paling Yu, 2001", ,530,,1,NTMBZeekanaal,schietfuiken,VVO,betonnen kopbalk
INBO:AQ:71,4/09/2014,4/09/2014,04,09,2014,2014-09-04,Kanaal Brussel-Schelde,RO Wintam,143396.457,199875.659,paling,Aal,,"Anguilla anguilla (Linnaeus, 1758)","Epilachna paling Yu, 2001", ,585,,1,NTMBZeekanaal,schietfuiken,VVO,betonnen kopbalk
INBO:AQ:72,4/09/2014,4/09/2014,04,09,2014,2014-09-04,Kanaal Brussel-Schelde,RO Wintam zone 1,145583.319,200539.564,paling,Aal,,"Anguilla anguilla (Linnaeus, 1758)","Epilachna paling Yu, 2001", ,362,,1,NTMBZeekanaal,schietfuiken,NTMB,moerasvegetaties
INBO:AQ:73,4/09/2014,4/09/2014,04,09,2014,2014-09-04,Kanaal Brussel-Schelde,RO Wintam zone 1,145583.319,200539.564,paling,Aal,,"Anguilla anguilla (Linnaeus, 1758)","Epilachna paling Yu, 2001", ,375,,1,NTMBZeekanaal,schietfuiken,NTMB,moerasvegetaties
INBO:AQ:74,4/09/2014,4/09/2014,04,09,2014,2014-09-04,Kanaal Brussel-Schelde,RO Wintam zone 1,145583.319,200539.564,paling,Aal,,"Anguilla anguilla (Linnaeus, 1758)","Epilachna paling Yu, 2001", ,412,,1,NTMBZeekanaal,schietfuiken,NTMB,moerasvegetaties
INBO:AQ:75,4/09/2014,4/09/2014,04,09,2014,2014-09-04,Kanaal Brussel-Schelde,RO Wintam zone 1,145583.319,200539.564,paling,Aal,,"Anguilla anguilla (Linnaeus, 1758)","Epilachna paling Yu, 2001", ,435,,1,NTMBZeekanaal,schietfuiken,NTMB,moerasvegetaties
INBO:AQ:76,4/09/2014,4/09/2014,04,09,2014,2014-09-04,Kanaal Brussel-Schelde,RO Wintam zone 1,145583.319,200539.564,paling,Aal,,"Anguilla anguilla (Linnaeus, 1758)","Epilachna paling Yu, 2001", ,490,,1,NTMBZeekanaal,schietfuiken,NTMB,moerasvegetaties
INBO:AQ:77,4/09/2014,4/09/2014,04,09,2014,2014-09-04,Kanaal Brussel-Schelde,RO Wintam zone 1,145583.319,200539.564,paling,Aal,,"Anguilla anguilla (Linnaeus, 1758)","Epilachna paling Yu, 2001", ,532,,1,NTMBZeekanaal,schietfuiken,NTMB,moerasvegetaties
INBO:AQ:78,4/09/2014,4/09/2014,04,09,2014,2014-09-04,Kanaal Brussel-Schelde,RO Wintam zone 1,145583.319,200539.564,paling,Aal,,"Anguilla anguilla (Linnaeus, 1758)","Epilachna paling Yu, 2001", ,565,,1,NTMBZeekanaal,schietfuiken,NTMB,moerasvegetaties
INBO:AQ:79,4/09/2014,4/09/2014,04,09,2014,2014-09-04,Kanaal Brussel-Schelde,RO Wintam zone 1,145583.319,200539.564,paling,Aal,,"Anguilla anguilla (Linnaeus, 1758)","Epilachna paling Yu, 2001", ,566,,1,NTMBZeekanaal,schietfuiken,NTMB,moerasvegetaties
INBO:AQ:80,4/09/2014,4/09/2014,04,09,2014,2014-09-04,Kanaal Brussel-Schelde,RO Wintam zone 1,145583.319,200539.564,paling,Aal,,"Anguilla anguilla (Linnaeus, 1758)","Epilachna paling Yu, 2001", ,567,,1,NTMBZeekanaal,schietfuiken,NTMB,moerasvegetaties
INBO:AQ:81,4/09/2014,4/09/2014,04,09,2014,2014-09-04,Kanaal Brussel-Schelde,RO Wintam zone 1,145583.319,200539.564,paling,Aal,,"Anguilla anguilla (Linnaeus, 1758)","Epilachna paling Yu, 2001", ,632,,1,NTMBZeekanaal,schietfuiken,NTMB,moerasvegetaties
INBO:AQ:82,4/09/2014,4/09/2014,04,09,2014,2014-09-04,Kanaal Brussel-Schelde,RO Wintam zone 1,145583.319,200539.564,paling,Aal,,"Anguilla anguilla (Linnaeus, 1758)","Epilachna paling Yu, 2001", ,662,,1,NTMBZeekanaal,schietfuiken,NTMB,moerasvegetaties
INBO:AQ:83,4/09/2014,4/09/2014,04,09,2014,2014-09-04,Kanaal Brussel-Schelde,RO Wintam zone 1,145583.319,200539.564,paling,Aal,,"Anguilla anguilla (Linnaeus, 1758)","Epilachna paling Yu, 2001", ,668,,1,NTMBZeekanaal,schietfuiken,NTMB,moerasvegetaties
INBO:AQ:84,4/09/2014,4/09/2014,04,09,2014,2014-09-04,Kanaal Brussel-Schelde,RO Wintam zone 1,145583.319,200539.564,paling,Aal,,"Anguilla anguilla (Linnaeus, 1758)","Epilachna paling Yu, 2001", ,702,,1,NTMBZeekanaal,schietfuiken,NTMB,moerasvegetaties
INBO:AQ:85,4/09/2014,4/09/2014,04,09,2014,2014-09-04,Kanaal Brussel-Schelde,RO Wintam zone 1,145583.319,200539.564,paling,Aal,,"Anguilla anguilla (Linnaeus, 1758)","Epilachna paling Yu, 2001", ,814,,1,NTMBZeekanaal,schietfuiken,NTMB,moerasvegetaties
INBO:AQ:86,4/09/2014,4/09/2014,04,09,2014,2014-09-04,Kanaal Brussel-Schelde,RO Wintam zone 2,145327.264,200389.792,paling,Aal,,"Anguilla anguilla (Linnaeus, 1758)","Epilachna paling Yu, 2001", ,336,,1,NTMBZeekanaal,schietfuiken,NTMB,moerasvegetaties
INBO:AQ:87,4/09/2014,4/09/2014,04,09,2014,2014-09-04,Kanaal Brussel-Schelde,RO Wintam zone 2,145327.264,200389.792,paling,Aal,,"Anguilla anguilla (Linnaeus, 1758)","Epilachna paling Yu, 2001", ,384,,1,NTMBZeekanaal,schietfuiken,NTMB,moerasvegetaties
INBO:AQ:88,4/09/2014,4/09/2014,04,09,2014,2014-09-04,Kanaal Brussel-Schelde,RO Wintam zone 2,145327.264,200389.792,paling,Aal,,"Anguilla anguilla (Linnaeus, 1758)","Epilachna paling Yu, 2001", ,395,,1,NTMBZeekanaal,schietfuiken,NTMB,moerasvegetaties
INBO:AQ:89,4/09/2014,4/09/2014,04,09,2014,2014-09-04,Kanaal Brussel-Schelde,RO Wintam zone 2,145327.264,200389.792,paling,Aal,,"Anguilla anguilla (Linnaeus, 1758)","Epilachna paling Yu, 2001", ,489,,1,NTMBZeekanaal,schietfuiken,NTMB,moerasvegetaties
INBO:AQ:90,4/09/2014,4/09/2014,04,09,2014,2014-09-04,Kanaal Brussel-Schelde,RO Wintam zone 2,145327.264,200389.792,paling,Aal,,"Anguilla anguilla (Linnaeus, 1758)","Epilachna paling Yu, 2001", ,508,,1,NTMBZeekanaal,schietfuiken,NTMB,moerasvegetaties
INBO:AQ:91,4/09/2014,4/09/2014,04,09,2014,2014-09-04,Kanaal Brussel-Schelde,RO Wintam zone 2,145327.264,200389.792,paling,Aal,,"Anguilla anguilla (Linnaeus, 1758)","Epilachna paling Yu, 2001", ,634,,1,NTMBZeekanaal,schietfuiken,NTMB,moerasvegetaties
INBO:AQ:92,4/09/2014,4/09/2014,04,09,2014,2014-09-04,Kanaal Brussel-Schelde,RO Wintam zone 2,145327.264,200389.792,paling,Aal,,"Anguilla anguilla (Linnaeus, 1758)","Epilachna paling Yu, 2001", ,710,,1,NTMBZeekanaal,schietfuiken,NTMB,moerasvegetaties
INBO:AQ:93,4/09/2014,4/09/2014,04,09,2014,2014-09-04,Kanaal Brussel-Schelde,RO Wintam zone 3,145322.009,200218.122,paling,Aal,,"Anguilla anguilla (Linnaeus, 1758)","Epilachna paling Yu, 2001", ,384,,1,NTMBZeekanaal,schietfuiken,NTMB,moerasvegetaties
INBO:AQ:94,4/09/2014,4/09/2014,04,09,2014,2014-09-04,Kanaal Brussel-Schelde,RO Wintam zone 3,145322.009,200218.122,paling,Aal,,"Anguilla anguilla (Linnaeus, 1758)","Epilachna paling Yu, 2001", ,408,,1,NTMBZeekanaal,schietfuiken,NTMB,moerasvegetaties
INBO:AQ:95,4/09/2014,4/09/2014,04,09,2014,2014-09-04,Kanaal Brussel-Schelde,RO Wintam zone 3,145322.009,200218.122,paling,Aal,,"Anguilla anguilla (Linnaeus, 1758)","Epilachna paling Yu, 2001", ,454,,1,NTMBZeekanaal,schietfuiken,NTMB,moerasvegetaties
INBO:AQ:96,4/09/2014,4/09/2014,04,09,2014,2014-09-04,Kanaal Brussel-Schelde,RO Wintam zone 3,145322.009,200218.122,paling,Aal,,"Anguilla anguilla (Linnaeus, 1758)","Epilachna paling Yu, 2001", ,475,,1,NTMBZeekanaal,schietfuiken,NTMB,moerasvegetaties
INBO:AQ:97,4/09/2014,4/09/2014,04,09,2014,2014-09-04,Kanaal Brussel-Schelde,RO Wintam zone 3,145322.009,200218.122,paling,Aal,,"Anguilla anguilla (Linnaeus, 1758)","Epilachna paling Yu, 2001", ,482,,1,NTMBZeekanaal,schietfuiken,NTMB,moerasvegetaties
INBO:AQ:98,4/09/2014,4/09/2014,04,09,2014,2014-09-04,Kanaal Brussel-Schelde,RO Wintam zone 3,145322.009,200218.122,paling,Aal,,"Anguilla anguilla (Linnaeus, 1758)","Epilachna paling Yu, 2001", ,497,,1,NTMBZeekanaal,schietfuiken,NTMB,moerasvegetaties
INBO:AQ:99,4/09/2014,4/09/2014,04,09,2014,2014-09-04,Kanaal Brussel-Schelde,RO Wintam zone 3,145322.009,200218.122,paling,Aal,,"Anguilla anguilla (Linnaeus, 1758)","Epilachna paling Yu, 2001", ,498,,1,NTMBZeekanaal,schietfuiken,NTMB,moerasvegetaties
INBO:AQ:100,4/09/2014,4/09/2014,04,09,2014,2014-09-04,Kanaal Brussel-Schelde,RO Wintam zone 3,145322.009,200218.122,paling,Aal,,"Anguilla anguilla (Linnaeus, 1758)","Epilachna paling Yu, 2001", ,503,,1,NTMBZeekanaal,schietfuiken,NTMB,moerasvegetaties
INBO:AQ:101,4/09/2014,4/09/2014,04,09,2014,2014-09-04,Kanaal Brussel-Schelde,RO Wintam zone 3,145322.009,200218.122,paling,Aal,,"Anguilla anguilla (Linnaeus, 1758)","Epilachna paling Yu, 2001", ,510,,1,NTMBZeekanaal,schietfuiken,NTMB,moerasvegetaties
INBO:AQ:102,4/09/2014,4/09/2014,04,09,2014,2014-09-04,Kanaal Brussel-Schelde,RO Wintam zone 3,145322.009,200218.122,paling,Aal,,"Anguilla anguilla (Linnaeus, 1758)","Epilachna paling Yu, 2001", ,520,,2,NTMBZeekanaal,schietfuiken,NTMB,moerasvegetaties
INBO:AQ:103,4/09/2014,4/09/2014,04,09,2014,2014-09-04,Kanaal Brussel-Schelde,RO Wintam zone 3,145322.009,200218.122,paling,Aal,,"Anguilla anguilla (Linnaeus, 1758)","Epilachna paling Yu, 2001", ,521,,1,NTMBZeekanaal,schietfuiken,NTMB,moerasvegetaties
INBO:AQ:104,4/09/2014,4/09/2014,04,09,2014,2014-09-04,Kanaal Brussel-Schelde,RO Wintam zone 3,145322.009,200218.122,paling,Aal,,"Anguilla anguilla (Linnaeus, 1758)","Epilachna paling Yu, 2001", ,531,,1,NTMBZeekanaal,schietfuiken,NTMB,moerasvegetaties
INBO:AQ:105,4/09/2014,4/09/2014,04,09,2014,2014-09-04,Kanaal Brussel-Schelde,RO Wintam zone 3,145322.009,200218.122,paling,Aal,,"Anguilla anguilla (Linnaeus, 1758)","Epilachna paling Yu, 2001", ,534,,1,NTMBZeekanaal,schietfuiken,NTMB,moerasvegetaties
INBO:AQ:106,4/09/2014,4/09/2014,04,09,2014,2014-09-04,Kanaal Brussel-Schelde,RO Wintam zone 3,145322.009,200218.122,paling,Aal,,"Anguilla anguilla (Linnaeus, 1758)","Epilachna paling Yu, 2001", ,555,,1,NTMBZeekanaal,schietfuiken,NTMB,moerasvegetaties
INBO:AQ:107,4/09/2014,4/09/2014,04,09,2014,2014-09-04,Kanaal Brussel-Schelde,RO Wintam zone 3,145322.009,200218.122,paling,Aal,,"Anguilla anguilla (Linnaeus, 1758)","Epilachna paling Yu, 2001", ,562,,1,NTMBZeekanaal,schietfuiken,NTMB,moerasvegetaties
INBO:AQ:108,4/09/2014,4/09/2014,04,09,2014,2014-09-04,Kanaal Brussel-Schelde,RO Wintam zone 3,145322.009,200218.122,paling,Aal,,"Anguilla anguilla (Linnaeus, 1758)","Epilachna paling Yu, 2001", ,572,,1,NTMBZeekanaal,schietfuiken,NTMB,moerasvegetaties
INBO:AQ:109,4/09/2014,4/09/2014,04,09,2014,2014-09-04,Kanaal Brussel-Schelde,RO Wintam zone 3,145322.009,200218.122,paling,Aal,,"Anguilla anguilla (Linnaeus, 1758)","Epilachna paling Yu, 2001", ,585,,1,NTMBZeekanaal,schietfuiken,NTMB,moerasvegetaties
INBO:AQ:110,4/09/2014,4/09/2014,04,09,2014,2014-09-04,Kanaal Brussel-Schelde,RO Wintam zone 3,145322.009,200218.122,paling,Aal,,"Anguilla anguilla (Linnaeus, 1758)","Epilachna paling Yu, 2001", ,586,,1,NTMBZeekanaal,schietfuiken,NTMB,moerasvegetaties
INBO:AQ:111,4/09/2014,4/09/2014,04,09,2014,2014-09-04,Kanaal Brussel-Schelde,RO Wintam zone 3,145322.009,200218.122,paling,Aal,,"Anguilla anguilla (Linnaeus, 1758)","Epilachna paling Yu, 2001", ,592,,1,NTMBZeekanaal,schietfuiken,NTMB,moerasvegetaties
INBO:AQ:112,4/09/2014,4/09/2014,04,09,2014,2014-09-04,Kanaal Brussel-Schelde,RO Wintam zone 3,145322.009,200218.122,paling,Aal,,"Anguilla anguilla (Linnaeus, 1758)","Epilachna paling Yu, 2001", ,602,,1,NTMBZeekanaal,schietfuiken,NTMB,moerasvegetaties
INBO:AQ:113,4/09/2014,4/09/2014,04,09,2014,2014-09-04,Kanaal Brussel-Schelde,RO Wintam zone 3,145322.009,200218.122,paling,Aal,,"Anguilla anguilla (Linnaeus, 1758)","Epilachna paling Yu, 2001", ,606,,1,NTMBZeekanaal,schietfuiken,NTMB,moerasvegetaties
INBO:AQ:114,4/09/2014,4/09/2014,04,09,2014,2014-09-04,Kanaal Brussel-Schelde,RO Wintam zone 3,145322.009,200218.122,paling,Aal,,"Anguilla anguilla (Linnaeus, 1758)","Epilachna paling Yu, 2001", ,641,,1,NTMBZeekanaal,schietfuiken,NTMB,moerasvegetaties
INBO:AQ:115,4/09/2014,4/09/2014,04,09,2014,2014-09-04,Kanaal Brussel-Schelde,RO Wintam zone 3,145322.009,200218.122,paling,Aal,,"Anguilla anguilla (Linnaeus, 1758)","Epilachna paling Yu, 2001", ,652,,1,NTMBZeekanaal,schietfuiken,NTMB,moerasvegetaties
INBO:AQ:116,4/09/2014,4/09/2014,04,09,2014,2014-09-04,Kanaal Brussel-Schelde,RO Wintam zone 3,145322.009,200218.122,paling,Aal,,"Anguilla anguilla (Linnaeus, 1758)","Epilachna paling Yu, 2001", ,730,,1,NTMBZeekanaal,schietfuiken,NTMB,moerasvegetaties
INBO:AQ:117,4/09/2014,4/09/2014,04,09,2014,2014-09-04,Kanaal Brussel-Schelde,RO Wintam zone 3,145322.009,200218.122,paling,Aal,,"Anguilla anguilla (Linnaeus, 1758)","Epilachna paling Yu, 2001", ,742,,1,NTMBZeekanaal,schietfuiken,NTMB,moerasvegetaties
INBO:AQ:118,4/09/2014,4/09/2014,04,09,2014,2014-09-04,Kanaal Brussel-Schelde,RO Wintam zone 3,145322.009,200218.122,paling,Aal,,"Anguilla anguilla (Linnaeus, 1758)","Epilachna paling Yu, 2001", ,750,,1,NTMBZeekanaal,schietfuiken,NTMB,moerasvegetaties
INBO:AQ:119,4/09/2014,4/09/2014,04,09,2014,2014-09-04,Kanaal Brussel-Schelde,RO Wintam,145328.14,200090.246,paling,Aal,,"Anguilla anguilla (Linnaeus, 1758)","Epilachna paling Yu, 2001", ,395,,1,NTMBZeekanaal,schietfuiken,NTMB,riet
INBO:AQ:120,4/09/2014,4/09/2014,04,09,2014,2014-09-04,Kanaal Brussel-Schelde,RO Wintam,145328.14,200090.246,paling,Aal,,"Anguilla anguilla (Linnaeus, 1758)","Epilachna paling Yu, 2001", ,478,,1,NTMBZeekanaal,schietfuiken,NTMB,riet
INBO:AQ:121,4/09/2014,4/09/2014,04,09,2014,2014-09-04,Kanaal Brussel-Schelde,RO Wintam,145328.14,200090.246,paling,Aal,,"Anguilla anguilla (Linnaeus, 1758)","Epilachna paling Yu, 2001", ,512,,1,NTMBZeekanaal,schietfuiken,NTMB,riet
INBO:AQ:122,4/09/2014,4/09/2014,04,09,2014,2014-09-04,Kanaal Brussel-Schelde,RO Wintam,145328.14,200090.246,paling,Aal,,"Anguilla anguilla (Linnaeus, 1758)","Epilachna paling Yu, 2001", ,542,,1,NTMBZeekanaal,schietfuiken,NTMB,riet
INBO:AQ:123,4/09/2014,4/09/2014,04,09,2014,2014-09-04,Kanaal Brussel-Schelde,RO Wintam,145328.14,200090.246,paling,Aal,,"Anguilla anguilla (Linnaeus, 1758)","Epilachna paling Yu, 2001", ,549,,1,NTMBZeekanaal,schietfuiken,NTMB,riet
INBO:AQ:124,4/09/2014,4/09/2014,04,09,2014,2014-09-04,Kanaal Brussel-Schelde,RO Wintam,145328.14,200090.246,paling,Aal,,"Anguilla anguilla (Linnaeus, 1758)","Epilachna paling Yu, 2001", ,561,,1,NTMBZeekanaal,schietfuiken,NTMB,riet
INBO:AQ:125,4/09/2014,4/09/2014,04,09,2014,2014-09-04,Kanaal Brussel-Schelde,RO Wintam,145328.14,200090.246,paling,Aal,,"Anguilla anguilla (Linnaeus, 1758)","Epilachna paling Yu, 2001", ,595,,1,NTMBZeekanaal,schietfuiken,NTMB,riet
INBO:AQ:126,4/09/2014,4/09/2014,04,09,2014,2014-09-04,Kanaal Brussel-Schelde,RO Wintam,145328.14,200090.246,paling,Aal,,"Anguilla anguilla (Linnaeus, 1758)","Epilachna paling Yu, 2001", ,607,,1,NTMBZeekanaal,schietfuiken,NTMB,riet
INBO:AQ:127,4/09/2014,4/09/2014,04,09,2014,2014-09-04,Kanaal Brussel-Schelde,RO Wintam,145328.14,200090.246,paling,Aal,,"Anguilla anguilla (Linnaeus, 1758)","Epilachna paling Yu, 2001", ,686,,1,NTMBZeekanaal,schietfuiken,NTMB,riet
INBO:AQ:128,4/09/2014,4/09/2014,04,09,2014,2014-09-04,Kanaal Brussel-Schelde,LO Lot,142638.982,161424.946,paling,Aal,,"Anguilla anguilla (Linnaeus, 1758)","Epilachna paling Yu, 2001", ,513,,1,NTMBZeekanaal,schietfuiken,NTMB,riet
INBO:AQ:129,24/06/2014,24/06/2014,24,06,2014,2014-06-24,Kanaal Leuven-Dijle,LO stroomopwaarts Bieststraat,163228.966,185098.805,paling,Aal,,"Anguilla anguilla (Linnaeus, 1758)","Epilachna paling Yu, 2001", ,400,,1,NTMBZeekanaal,elektrische bevissing,VVO,schanskorven
INBO:AQ:130,24/06/2014,24/06/2014,24,06,2014,2014-06-24,Kanaal Leuven-Dijle,LO stroomafwaarts Bieststraat,162275,186062.066,paling,Aal,,"Anguilla anguilla (Linnaeus, 1758)","Epilachna paling Yu, 2001", ,643,,1,NTMBZeekanaal,elektrische bevissing,NTMB,moerasvegetaties
INBO:AQ:131,24/06/2014,24/06/2014,24,06,2014,2014-06-24,Kanaal Leuven-Dijle,LO stroomafwaarts Bieststraat,162275,186062.066,paling,Aal,,"Anguilla anguilla (Linnaeus, 1758)","Epilachna paling Yu, 2001", ,696,,1,NTMBZeekanaal,elektrische bevissing,NTMB,moerasvegetaties
INBO:AQ:132,22/07/2014,22/07/2014,22,07,2014,2014-07-22,Kanaal Brussel-Schelde,RO Grimbergen zone 2,152073.166,184314.048,kolblei,Kolblei,,"Blicca bjoerkna (Linnaeus, 1758)","Blicca bjoerkna (Linnaeus, 1758)", ,85,,1,NTMBZeekanaal,elektrische bevissing,NTMB,afkalvende oever
INBO:AQ:133,4/09/2014,4/09/2014,04,09,2014,2014-09-04,Kanaal Brussel-Schelde,LO Lot,142638.982,161424.946,kolblei,Kolblei,,"Blicca bjoerkna (Linnaeus, 1758)","Blicca bjoerkna (Linnaeus, 1758)", ,48,,1,NTMBZeekanaal,elektrische bevissing,NTMB,riet
INBO:AQ:134,4/09/2014,4/09/2014,04,09,2014,2014-09-04,Kanaal Brussel-Schelde,LO Lot,142638.982,161424.946,kolblei,Kolblei,,"Blicca bjoerkna (Linnaeus, 1758)","Blicca bjoerkna (Linnaeus, 1758)", ,51,,1,NTMBZeekanaal,elektrische bevissing,NTMB,riet
INBO:AQ:135,4/09/2014,4/09/2014,04,09,2014,2014-09-04,Kanaal Brussel-Schelde,LO Lot,142638.982,161424.946,kolblei,Kolblei,,"Blicca bjoerkna (Linnaeus, 1758)","Blicca bjoerkna (Linnaeus, 1758)", ,52,,1,NTMBZeekanaal,elektrische bevissing,NTMB,riet
INBO:AQ:136,4/09/2014,4/09/2014,04,09,2014,2014-09-04,Kanaal Brussel-Schelde,LO Lot,142638.982,161424.946,kolblei,Kolblei,,"Blicca bjoerkna (Linnaeus, 1758)","Blicca bjoerkna (Linnaeus, 1758)", ,55,,1,NTMBZeekanaal,elektrische bevissing,NTMB,riet
INBO:AQ:137,4/09/2014,4/09/2014,04,09,2014,2014-09-04,Kanaal Brussel-Schelde,LO Lot,142638.982,161424.946,kolblei,Kolblei,,"Blicca bjoerkna (Linnaeus, 1758)","Blicca bjoerkna (Linnaeus, 1758)", ,57,,2,NTMBZeekanaal,elektrische bevissing,NTMB,riet
INBO:AQ:138,4/09/2014,4/09/2014,04,09,2014,2014-09-04,Kanaal Brussel-Schelde,RO Wintam,143396.457,199875.659,kolblei,Kolblei,,"Blicca bjoerkna (Linnaeus, 1758)","Blicca bjoerkna (Linnaeus, 1758)", ,83,,1,NTMBZeekanaal,schietfuiken,VVO,betonnen kopbalk
INBO:AQ:139,4/09/2014,4/09/2014,04,09,2014,2014-09-04,Kanaal Brussel-Schelde,RO Wintam zone 1,145583.319,200539.564,kolblei,Kolblei,,"Blicca bjoerkna (Linnaeus, 1758)","Blicca bjoerkna (Linnaeus, 1758)", ,120,,1,NTMBZeekanaal,schietfuiken,NTMB,moerasvegetaties
INBO:AQ:140,4/09/2014,4/09/2014,04,09,2014,2014-09-04,Kanaal Brussel-Schelde,RO Wintam zone 2,145327.264,200389.792,kolblei,Kolblei,,"Blicca bjoerkna (Linnaeus, 1758)","Blicca bjoerkna (Linnaeus, 1758)", ,66,,1,NTMBZeekanaal,schietfuiken,NTMB,moerasvegetaties
INBO:AQ:141,4/09/2014,4/09/2014,04,09,2014,2014-09-04,Kanaal Brussel-Schelde,RO Wintam zone 2,145327.264,200389.792,kolblei,Kolblei,,"Blicca bjoerkna (Linnaeus, 1758)","Blicca bjoerkna (Linnaeus, 1758)", ,80,,1,NTMBZeekanaal,schietfuiken,NTMB,moerasvegetaties
INBO:AQ:142,4/09/2014,4/09/2014,04,09,2014,2014-09-04,Kanaal Brussel-Schelde,RO Wintam zone 2,145327.264,200389.792,kolblei,Kolblei,,"Blicca bjoerkna (Linnaeus, 1758)","Blicca bjoerkna (Linnaeus, 1758)", ,85,,1,NTMBZeekanaal,schietfuiken,NTMB,moerasvegetaties
INBO:AQ:143,4/09/2014,4/09/2014,04,09,2014,2014-09-04,Kanaal Brussel-Schelde,RO Wintam zone 3,145322.009,200218.122,kolblei,Kolblei,,"Blicca bjoerkna (Linnaeus, 1758)","Blicca bjoerkna (Linnaeus, 1758)", ,81,,1,NTMBZeekanaal,schietfuiken,NTMB,moerasvegetaties
INBO:AQ:144,4/09/2014,4/09/2014,04,09,2014,2014-09-04,Kanaal Brussel-Schelde,RO Wintam zone 3,145322.009,200218.122,kolblei,Kolblei,,"Blicca bjoerkna (Linnaeus, 1758)","Blicca bjoerkna (Linnaeus, 1758)", ,81,,1,NTMBZeekanaal,schietfuiken,NTMB,moerasvegetaties
INBO:AQ:145,4/09/2014,4/09/2014,04,09,2014,2014-09-04,Kanaal Brussel-Schelde,RO Wintam,145328.14,200090.246,kolblei,Kolblei,,"Blicca bjoerkna (Linnaeus, 1758)","Blicca bjoerkna (Linnaeus, 1758)", ,114,,1,NTMBZeekanaal,schietfuiken,NTMB,riet
INBO:AQ:146,4/09/2014,4/09/2014,04,09,2014,2014-09-04,Kanaal Brussel-Schelde,LO Lot,142617.889,161353.806,kolblei,Kolblei,,"Blicca bjoerkna (Linnaeus, 1758)","Blicca bjoerkna (Linnaeus, 1758)", ,162,,1,NTMBZeekanaal,schietfuiken,VVO,schanskorven
INBO:AQ:147,24/06/2014,24/06/2014,24,06,2014,2014-06-24,Kanaal Brussel-Schelde,LO Lot,142638.982,161424.946,giebel,,,"Analges bidentatus Giebel, 1871","Giebel, 1855 Thomomys bulbivora", ,18,,1,NTMBZeekanaal,elektrische bevissing,NTMB,riet
INBO:AQ:148,24/06/2014,24/06/2014,24,06,2014,2014-06-24,Kanaal Brussel-Schelde,LO Lot,142638.982,161424.946,giebel,,,"Analges bidentatus Giebel, 1871","Giebel, 1855 Thomomys bulbivora", ,22,,1,NTMBZeekanaal,elektrische bevissing,NTMB,riet
INBO:AQ:149,24/06/2014,24/06/2014,24,06,2014,2014-06-24,Kanaal Brussel-Schelde,LO Lot,142638.982,161424.946,giebel,,,"Analges bidentatus Giebel, 1871","Giebel, 1855 Thomomys bulbivora", ,23,,1,NTMBZeekanaal,elektrische bevissing,NTMB,riet
INBO:AQ:150,24/06/2014,24/06/2014,24,06,2014,2014-06-24,Kanaal Brussel-Schelde,LO Lot,142638.982,161424.946,giebel,,,"Analges bidentatus Giebel, 1871","Giebel, 1855 Thomomys bulbivora", ,25,,2,NTMBZeekanaal,elektrische bevissing,NTMB,riet
INBO:AQ:151,24/06/2014,24/06/2014,24,06,2014,2014-06-24,Kanaal Brussel-Schelde,LO Lot,142638.982,161424.946,giebel,,,"Analges bidentatus Giebel, 1871","Giebel, 1855 Thomomys bulbivora", ,29,,1,NTMBZeekanaal,elektrische bevissing,NTMB,riet
INBO:AQ:152,24/06/2014,24/06/2014,24,06,2014,2014-06-24,Kanaal Brussel-Schelde,LO Lot,142638.982,161424.946,giebel,,,"Analges bidentatus Giebel, 1871","Giebel, 1855 Thomomys bulbivora", ,30,,2,NTMBZeekanaal,elektrische bevissing,NTMB,riet
INBO:AQ:153,24/06/2014,24/06/2014,24,06,2014,2014-06-24,Kanaal Brussel-Schelde,LO Lot,142638.982,161424.946,giebel,,,"Analges bidentatus Giebel, 1871","Giebel, 1855 Thomomys bulbivora", ,31,,1,NTMBZeekanaal,elektrische bevissing,NTMB,riet
INBO:AQ:154,24/06/2014,24/06/2014,24,06,2014,2014-06-24,Kanaal Brussel-Schelde,LO Lot,142638.982,161424.946,giebel,,,"Analges bidentatus Giebel, 1871","Giebel, 1855 Thomomys bulbivora", ,33,,3,NTMBZeekanaal,elektrische bevissing,NTMB,riet
INBO:AQ:155,24/06/2014,24/06/2014,24,06,2014,2014-06-24,Kanaal Brussel-Schelde,LO Lot,142638.982,161424.946,giebel,,,"Analges bidentatus Giebel, 1871","Giebel, 1855 Thomomys bulbivora", ,34,,1,NTMBZeekanaal,elektrische bevissing,NTMB,riet
INBO:AQ:156,24/06/2014,24/06/2014,24,06,2014,2014-06-24,Kanaal Brussel-Schelde,LO Lot,142638.982,161424.946,giebel,,,"Analges bidentatus Giebel, 1871","Giebel, 1855 Thomomys bulbivora", ,35,,3,NTMBZeekanaal,elektrische bevissing,NTMB,riet
INBO:AQ:157,24/06/2014,24/06/2014,24,06,2014,2014-06-24,Kanaal Brussel-Schelde,LO Lot,142638.982,161424.946,giebel,,,"Analges bidentatus Giebel, 1871","Giebel, 1855 Thomomys bulbivora", ,36,,3,NTMBZeekanaal,elektrische bevissing,NTMB,riet
INBO:AQ:158,24/06/2014,24/06/2014,24,06,2014,2014-06-24,Kanaal Brussel-Schelde,LO Lot,142638.982,161424.946,giebel,,,"Analges bidentatus Giebel, 1871","Giebel, 1855 Thomomys bulbivora", ,37,,1,NTMBZeekanaal,elektrische bevissing,NTMB,riet
INBO:AQ:159,24/06/2014,24/06/2014,24,06,2014,2014-06-24,Kanaal Brussel-Schelde,LO Lot,142638.982,161424.946,giebel,,,"Analges bidentatus Giebel, 1871","Giebel, 1855 Thomomys bulbivora", ,38,,3,NTMBZeekanaal,elektrische bevissing,NTMB,riet
INBO:AQ:160,24/06/2014,24/06/2014,24,06,2014,2014-06-24,Kanaal Brussel-Schelde,LO Lot,142638.982,161424.946,giebel,,,"Analges bidentatus Giebel, 1871","Giebel, 1855 Thomomys bulbivora", ,40,,3,NTMBZeekanaal,elektrische bevissing,NTMB,riet
INBO:AQ:161,24/06/2014,24/06/2014,24,06,2014,2014-06-24,Kanaal Brussel-Schelde,LO Lot,142638.982,161424.946,giebel,,,"Analges bidentatus Giebel, 1871","Giebel, 1855 Thomomys bulbivora", ,44,,1,NTMBZeekanaal,elektrische bevissing,NTMB,riet
INBO:AQ:162,4/09/2014,4/09/2014,04,09,2014,2014-09-04,Kanaal Brussel-Schelde,RO Wintam zone 3,145322.009,200218.122,giebel,,,"Analges bidentatus Giebel, 1871","Giebel, 1855 Thomomys bulbivora", ,372,,1,NTMBZeekanaal,schietfuiken,NTMB,moerasvegetaties
INBO:AQ:163,4/09/2015,4/09/2015,04,09,2015,2015-09-04,Kanaal Leuven-Dijle,LO stroomopwaarts Bieststraat,163173.526,185115.914,giebel,,,"Analges bidentatus Giebel, 1871","Giebel, 1855 Thomomys bulbivora", ,94,,1,NTMBZeekanaal,elektrische bevissing,NTMB,moerasvegetaties
INBO:AQ:164,4/09/2015,4/09/2015,04,09,2015,2015-09-04,Kanaal Leuven-Dijle,LO stroomopwaarts Bieststraat,163173.526,185115.914,giebel,,,"Analges bidentatus Giebel, 1871","Giebel, 1855 Thomomys bulbivora", ,101,,1,NTMBZeekanaal,elektrische bevissing,NTMB,moerasvegetaties
INBO:AQ:165,4/09/2015,4/09/2015,04,09,2015,2015-09-04,Kanaal Leuven-Dijle,LO stroomopwaarts Bieststraat,163173.526,185115.914,giebel,,,"Analges bidentatus Giebel, 1871","Giebel, 1855 Thomomys bulbivora", ,103,,1,NTMBZeekanaal,elektrische bevissing,NTMB,moerasvegetaties
INBO:AQ:166,4/09/2015,4/09/2015,04,09,2015,2015-09-04,Kanaal Leuven-Dijle,LO stroomopwaarts Bieststraat,163173.526,185115.914,giebel,,,"Analges bidentatus Giebel, 1871","Giebel, 1855 Thomomys bulbivora", ,104,,1,NTMBZeekanaal,elektrische bevissing,NTMB,moerasvegetaties
INBO:AQ:167,4/09/2015,4/09/2015,04,09,2015,2015-09-04,Kanaal Leuven-Dijle,LO stroomopwaarts Bieststraat,163173.526,185115.914,giebel,,,"Analges bidentatus Giebel, 1871","Giebel, 1855 Thomomys bulbivora", ,121,,1,NTMBZeekanaal,elektrische bevissing,NTMB,moerasvegetaties
INBO:AQ:168,4/09/2015,4/09/2015,04,09,2015,2015-09-04,Kanaal Leuven-Dijle,LO stroomopwaarts Bieststraat,163173.526,185115.914,giebel,,,"Analges bidentatus Giebel, 1871","Giebel, 1855 Thomomys bulbivora", ,127,,1,NTMBZeekanaal,elektrische bevissing,NTMB,moerasvegetaties
INBO:AQ:169,4/09/2015,4/09/2015,04,09,2015,2015-09-04,Kanaal Leuven-Dijle,LO stroomopwaarts Bieststraat,163173.526,185115.914,giebel,,,"Analges bidentatus Giebel, 1871","Giebel, 1855 Thomomys bulbivora", ,129,,1,NTMBZeekanaal,elektrische bevissing,NTMB,moerasvegetaties
INBO:AQ:170,4/09/2014,4/09/2014,04,09,2014,2014-09-04,Kanaal Brussel-Schelde,RO Wintam zone 1,145583.319,200539.564,diklipharder,Diklipharder,,"Chelon labrosus (Risso, 1826)","Chelon labrosus (Risso, 1826)", ,128,,1,NTMBZeekanaal,schietfuiken,NTMB,moerasvegetaties
INBO:AQ:171,4/09/2014,4/09/2014,04,09,2014,2014-09-04,Kanaal Brussel-Schelde,RO Wintam zone 1,145583.319,200539.564,diklipharder,Diklipharder,,"Chelon labrosus (Risso, 1826)","Chelon labrosus (Risso, 1826)", ,129,,1,NTMBZeekanaal,schietfuiken,NTMB,moerasvegetaties
INBO:AQ:172,23/07/2014,23/07/2014,23,07,2014,2014-07-23,Kanaal Brussel-Schelde,LO Lot,142638.982,161424.946,karper,Karper,,"Cyprinus carpio Linnaeus, 1758","Cyprinus carpio Linnaeus, 1758", ,22,,1,NTMBZeekanaal,elektrische bevissing,NTMB,riet
INBO:AQ:173,23/07/2014,23/07/2014,23,07,2014,2014-07-23,Kanaal Brussel-Schelde,LO Lot,142638.982,161424.946,karper,Karper,,"Cyprinus carpio Linnaeus, 1758","Cyprinus carpio Linnaeus, 1758", ,30,,1,NTMBZeekanaal,elektrische bevissing,NTMB,riet
INBO:AQ:174,23/07/2014,23/07/2014,23,07,2014,2014-07-23,Kanaal Brussel-Schelde,LO Lot,142638.982,161424.946,karper,Karper,,"Cyprinus carpio Linnaeus, 1758","Cyprinus carpio Linnaeus, 1758", ,65,,1,NTMBZeekanaal,elektrische bevissing,NTMB,riet
INBO:AQ:175,22/07/2014,22/07/2014,22,07,2014,2014-07-22,Kanaal Brussel-Schelde,LO Grimbergen 4a,152143.521,183945.43,karper,Karper,,"Cyprinus carpio Linnaeus, 1758","Cyprinus carpio Linnaeus, 1758", ,50,,2,NTMBZeekanaal,elektrische bevissing,NTMB,breuksteen
INBO:AQ:176,23/07/2014,23/07/2014,23,07,2014,2014-07-23,Kanaal Brussel-Schelde,LO Lot,142638.982,161424.946,karper,Karper,,"Cyprinus carpio Linnaeus, 1758","Cyprinus carpio Linnaeus, 1758", ,22,,1,NTMBZeekanaal,elektrische bevissing,NTMB,riet
INBO:AQ:177,23/07/2014,23/07/2014,23,07,2014,2014-07-23,Kanaal Brussel-Schelde,LO Lot,142638.982,161424.946,karper,Karper,,"Cyprinus carpio Linnaeus, 1758","Cyprinus carpio Linnaeus, 1758", ,30,,1,NTMBZeekanaal,elektrische bevissing,NTMB,riet
INBO:AQ:178,23/07/2014,23/07/2014,23,07,2014,2014-07-23,Kanaal Brussel-Schelde,LO Lot,142638.982,161424.946,karper,Karper,,"Cyprinus carpio Linnaeus, 1758","Cyprinus carpio Linnaeus, 1758", ,65,,1,NTMBZeekanaal,elektrische bevissing,NTMB,riet
INBO:AQ:179,24/06/2014,24/06/2014,24,06,2014,2014-06-24,Kanaal Leuven-Dijle,LO stroomopwaarts Bieststraat,163173.526,185115.914,karper,Karper,,"Cyprinus carpio Linnaeus, 1758","Cyprinus carpio Linnaeus, 1758", ,20,,1,NTMBZeekanaal,elektrische bevissing,NTMB,moerasvegetaties
INBO:AQ:180,24/06/2014,24/06/2014,24,06,2014,2014-06-24,Kanaal Leuven-Dijle,LO stroomopwaarts Bieststraat,163173.526,185115.914,karper,Karper,,"Cyprinus carpio Linnaeus, 1758","Cyprinus carpio Linnaeus, 1758", ,22,,1,NTMBZeekanaal,elektrische bevissing,NTMB,moerasvegetaties
INBO:AQ:181,24/06/2014,24/06/2014,24,06,2014,2014-06-24,Kanaal Leuven-Dijle,LO stroomopwaarts Bieststraat,163173.526,185115.914,karper,Karper,,"Cyprinus carpio Linnaeus, 1758","Cyprinus carpio Linnaeus, 1758", ,24,,1,NTMBZeekanaal,elektrische bevissing,NTMB,moerasvegetaties
INBO:AQ:182,24/06/2014,24/06/2014,24,06,2014,2014-06-24,Kanaal Leuven-Dijle,LO stroomopwaarts Bieststraat,163173.526,185115.914,karper,Karper,,"Cyprinus carpio Linnaeus, 1758","Cyprinus carpio Linnaeus, 1758", ,25,,1,NTMBZeekanaal,elektrische bevissing,NTMB,moerasvegetaties
INBO:AQ:183,24/06/2014,24/06/2014,24,06,2014,2014-06-24,Kanaal Leuven-Dijle,LO stroomopwaarts Bieststraat,163173.526,185115.914,karper,Karper,,"Cyprinus carpio Linnaeus, 1758","Cyprinus carpio Linnaeus, 1758", ,27,,1,NTMBZeekanaal,elektrische bevissing,NTMB,moerasvegetaties
INBO:AQ:184,24/06/2014,24/06/2014,24,06,2014,2014-06-24,Kanaal Leuven-Dijle,LO stroomopwaarts Bieststraat,163173.526,185115.914,karper,Karper,,"Cyprinus carpio Linnaeus, 1758","Cyprinus carpio Linnaeus, 1758", ,28,,1,NTMBZeekanaal,elektrische bevissing,NTMB,moerasvegetaties
INBO:AQ:185,24/06/2014,24/06/2014,24,06,2014,2014-06-24,Kanaal Leuven-Dijle,LO stroomopwaarts Bieststraat,163173.526,185115.914,karper,Karper,,"Cyprinus carpio Linnaeus, 1758","Cyprinus carpio Linnaeus, 1758", ,29,,1,NTMBZeekanaal,elektrische bevissing,NTMB,moerasvegetaties
INBO:AQ:186,4/09/2014,4/09/2014,04,09,2014,2014-09-04,Kanaal Brussel-Schelde,RO Wintam zone 1,145583.319,200539.564,zeebaars,Zeebaars,,"Dicentrarchus labrax (Linnaeus, 1758)","Dicentrarchus labrax (Linnaeus, 1758)", ,75,,1,NTMBZeekanaal,schietfuiken,NTMB,moerasvegetaties
INBO:AQ:187,4/09/2014,4/09/2014,04,09,2014,2014-09-04,Kanaal Brussel-Schelde,RO Wintam zone 2,145327.264,200389.792,zeebaars,Zeebaars,,"Dicentrarchus labrax (Linnaeus, 1758)","Dicentrarchus labrax (Linnaeus, 1758)", ,63,,1,NTMBZeekanaal,schietfuiken,NTMB,moerasvegetaties
INBO:AQ:188,4/09/2014,4/09/2014,04,09,2014,2014-09-04,Kanaal Brussel-Schelde,RO Wintam,145328.14,200090.246,zeebaars,Zeebaars,,"Dicentrarchus labrax (Linnaeus, 1758)","Dicentrarchus labrax (Linnaeus, 1758)", ,66,,1,NTMBZeekanaal,schietfuiken,NTMB,riet
INBO:AQ:189,4/09/2014,4/09/2014,04,09,2014,2014-09-04,Kanaal Brussel-Schelde,RO Wintam,145328.14,200090.246,zeebaars,Zeebaars,,"Dicentrarchus labrax (Linnaeus, 1758)","Dicentrarchus labrax (Linnaeus, 1758)", ,68,,1,NTMBZeekanaal,schietfuiken,NTMB,riet
INBO:AQ:190,4/09/2014,4/09/2014,04,09,2014,2014-09-04,Kanaal Brussel-Schelde,RO Wintam,145328.14,200090.246,zeebaars,Zeebaars,,"Dicentrarchus labrax (Linnaeus, 1758)","Dicentrarchus labrax (Linnaeus, 1758)", ,70,,2,NTMBZeekanaal,schietfuiken,NTMB,riet
INBO:AQ:191,4/09/2014,4/09/2014,04,09,2014,2014-09-04,Kanaal Brussel-Schelde,RO Wintam,145328.14,200090.246,zeebaars,Zeebaars,,"Dicentrarchus labrax (Linnaeus, 1758)","Dicentrarchus labrax (Linnaeus, 1758)", ,72,,2,NTMBZeekanaal,schietfuiken,NTMB,riet
INBO:AQ:192,4/09/2014,4/09/2014,04,09,2014,2014-09-04,Kanaal Brussel-Schelde,RO Wintam,145328.14,200090.246,zeebaars,Zeebaars,,"Dicentrarchus labrax (Linnaeus, 1758)","Dicentrarchus labrax (Linnaeus, 1758)", ,75,,1,NTMBZeekanaal,schietfuiken,NTMB,riet
INBO:AQ:193,4/09/2014,4/09/2014,04,09,2014,2014-09-04,Kanaal Brussel-Schelde,RO Wintam,145328.14,200090.246,zeebaars,Zeebaars,,"Dicentrarchus labrax (Linnaeus, 1758)","Dicentrarchus labrax (Linnaeus, 1758)", ,76,,1,NTMBZeekanaal,schietfuiken,NTMB,riet
INBO:AQ:194,4/09/2014,4/09/2014,04,09,2014,2014-09-04,Kanaal Brussel-Schelde,RO Wintam,145328.14,200090.246,zeebaars,Zeebaars,,"Dicentrarchus labrax (Linnaeus, 1758)","Dicentrarchus labrax (Linnaeus, 1758)", ,78,,1,NTMBZeekanaal,schietfuiken,NTMB,riet
INBO:AQ:195,4/09/2014,4/09/2014,04,09,2014,2014-09-04,Kanaal Brussel-Schelde,RO Wintam,145328.14,200090.246,zeebaars,Zeebaars,,"Dicentrarchus labrax (Linnaeus, 1758)","Dicentrarchus labrax (Linnaeus, 1758)", ,88,,1,NTMBZeekanaal,schietfuiken,NTMB,riet
INBO:AQ:196,4/09/2014,4/09/2014,04,09,2014,2014-09-04,Kanaal Brussel-Schelde,RO Wintam,145328.14,200090.246,zeebaars,Zeebaars,,"Dicentrarchus labrax (Linnaeus, 1758)","Dicentrarchus labrax (Linnaeus, 1758)", ,92,,1,NTMBZeekanaal,schietfuiken,NTMB,riet
INBO:AQ:197,4/09/2014,4/09/2014,04,09,2014,2014-09-04,Kanaal Brussel-Schelde,RO Wintam,145328.14,200090.246,zeebaars,Zeebaars,,"Dicentrarchus labrax (Linnaeus, 1758)","Dicentrarchus labrax (Linnaeus, 1758)", ,101,,1,NTMBZeekanaal,schietfuiken,NTMB,riet
INBO:AQ:198,4/09/2014,4/09/2014,04,09,2014,2014-09-04,Kanaal Brussel-Schelde,RO Wintam,145328.14,200090.246,zeebaars,Zeebaars,,"Dicentrarchus labrax (Linnaeus, 1758)","Dicentrarchus labrax (Linnaeus, 1758)", ,105,,1,NTMBZeekanaal,schietfuiken,NTMB,riet
INBO:AQ:199,4/09/2014,4/09/2014,04,09,2014,2014-09-04,Kanaal Brussel-Schelde,RO Wintam,143396.457,199875.659,snoek,Snoek,,"Esox lucius Linnaeus, 1758","Thyrsites atun (Euphrasen, 1791)", ,650,,1,NTMBZeekanaal,schietfuiken,VVO,betonnen kopbalk
INBO:AQ:200,23/06/2015,23/06/2015,23,06,2015,2015-06-23,Kanaal Leuven-Dijle,LO Aarschot,173757.68,176640.121,snoek,Snoek,,"Esox lucius Linnaeus, 1758","Thyrsites atun (Euphrasen, 1791)", ,110,,1,NTMBZeekanaal,elektrische bevissing,VVO,schanskorven
INBO:AQ:201,23/06/2015,23/06/2015,23,06,2015,2015-06-23,Kanaal Leuven-Dijle,LO Aarschot,173757.68,176640.121,snoek,Snoek,,"Esox lucius Linnaeus, 1758","Thyrsites atun (Euphrasen, 1791)", ,300,,1,NTMBZeekanaal,elektrische bevissing,VVO,schanskorven
INBO:AQ:202,23/06/2015,23/06/2015,23,06,2015,2015-06-23,Kanaal Leuven-Dijle,RO Aarschot,173789.027,176616.544,driedoornige stekelbaars,,,"Gasterosteus aculeatus
Linnaeus, 1758","Gasterosteus aculeatus
Linnaeus, 1758", ,62,,1,NTMBZeekanaal,elektrische bevissing,NTMB,riet
INBO:AQ:203,23/06/2015,23/06/2015,23,06,2015,2015-06-23,Kanaal Leuven-Dijle,LO Aarschot,173757.68,176640.121,driedoornige stekelbaars,,,"Gasterosteus aculeatus
Linnaeus, 1758","Gasterosteus aculeatus
Linnaeus, 1758", ,54,,1,NTMBZeekanaal,elektrische bevissing,VVO,schanskorven
INBO:AQ:204,3/09/2015,3/09/2015,03,09,2015,2015-09-03,Kanaal Leuven-Dijle,LO Herent,171334.748,180467.176,driedoornige stekelbaars,,,"Gasterosteus aculeatus
Linnaeus, 1758","Gasterosteus aculeatus
Linnaeus, 1758", ,29,,1,NTMBZeekanaal,elektrische bevissing,NTMB,moerasvegetaties
INBO:AQ:205,23/06/2014,23/06/2014,23,06,2014,2014-06-23,Kanaal Brussel-Schelde,RO Grimbergen zone 1,152032.155,184397.392,driedoornige stekelbaars,,,"Gasterosteus aculeatus
Linnaeus, 1758","Gasterosteus aculeatus
Linnaeus, 1758", ,27,,1,NTMBZeekanaal,elektrische bevissing,NTMB,houtige begroeiing
INBO:AQ:206,24/06/2014,24/06/2014,24,06,2014,2014-06-24,Kanaal Brussel-Schelde,RO Wintam zone 1,145583.319,200539.564,driedoornige stekelbaars,,,"Gasterosteus aculeatus
Linnaeus, 1758","Gasterosteus aculeatus
Linnaeus, 1758", ,30,,3,NTMBZeekanaal,elektrische bevissing,NTMB,moerasvegetaties
INBO:AQ:207,24/06/2014,24/06/2014,24,06,2014,2014-06-24,Kanaal Brussel-Schelde,RO Wintam zone 1,145583.319,200539.564,driedoornige stekelbaars,,,"Gasterosteus aculeatus
Linnaeus, 1758","Gasterosteus aculeatus
Linnaeus, 1758", ,31,,1,NTMBZeekanaal,elektrische bevissing,NTMB,moerasvegetaties
INBO:AQ:208,24/06/2014,24/06/2014,24,06,2014,2014-06-24,Kanaal Brussel-Schelde,RO Wintam zone 1,145583.319,200539.564,driedoornige stekelbaars,,,"Gasterosteus aculeatus
Linnaeus, 1758","Gasterosteus aculeatus
Linnaeus, 1758", ,34,,1,NTMBZeekanaal,elektrische bevissing,NTMB,moerasvegetaties
INBO:AQ:209,24/06/2014,24/06/2014,24,06,2014,2014-06-24,Kanaal Brussel-Schelde,RO Wintam zone 1,145583.319,200539.564,driedoornige stekelbaars,,,"Gasterosteus aculeatus
Linnaeus, 1758","Gasterosteus aculeatus
Linnaeus, 1758", ,35,,1,NTMBZeekanaal,elektrische bevissing,NTMB,moerasvegetaties
INBO:AQ:210,24/06/2014,24/06/2014,24,06,2014,2014-06-24,Kanaal Brussel-Schelde,RO Wintam zone 1,145583.319,200539.564,driedoornige stekelbaars,,,"Gasterosteus aculeatus
Linnaeus, 1758","Gasterosteus aculeatus
Linnaeus, 1758", ,36,,1,NTMBZeekanaal,elektrische bevissing,NTMB,moerasvegetaties
INBO:AQ:211,24/06/2014,24/06/2014,24,06,2014,2014-06-24,Kanaal Brussel-Schelde,RO Wintam zone 3,145322.009,200218.122,driedoornige stekelbaars,,,"Gasterosteus aculeatus
Linnaeus, 1758","Gasterosteus aculeatus
Linnaeus, 1758", ,32,,1,NTMBZeekanaal,elektrische bevissing,NTMB,moerasvegetaties
INBO:AQ:212,24/06/2014,24/06/2014,24,06,2014,2014-06-24,Kanaal Brussel-Schelde,RO Wintam zone 3,145322.009,200218.122,driedoornige stekelbaars,,,"Gasterosteus aculeatus
Linnaeus, 1758","Gasterosteus aculeatus
Linnaeus, 1758", ,33,,1,NTMBZeekanaal,elektrische bevissing,NTMB,moerasvegetaties
INBO:AQ:213,24/06/2014,24/06/2014,24,06,2014,2014-06-24,Kanaal Brussel-Schelde,RO Wintam,145328.14,200090.246,driedoornige stekelbaars,,,"Gasterosteus aculeatus
Linnaeus, 1758","Gasterosteus aculeatus
Linnaeus, 1758", ,27,,2,NTMBZeekanaal,elektrische bevissing,NTMB,riet
INBO:AQ:214,24/06/2014,24/06/2014,24,06,2014,2014-06-24,Kanaal Brussel-Schelde,RO Wintam,145328.14,200090.246,driedoornige stekelbaars,,,"Gasterosteus aculeatus
Linnaeus, 1758","Gasterosteus aculeatus
Linnaeus, 1758", ,30,,1,NTMBZeekanaal,elektrische bevissing,NTMB,riet
INBO:AQ:215,24/06/2014,24/06/2014,24,06,2014,2014-06-24,Kanaal Brussel-Schelde,LO Lot,142638.982,161424.946,driedoornige stekelbaars,,,"Gasterosteus aculeatus
Linnaeus, 1758","Gasterosteus aculeatus
Linnaeus, 1758", ,27,,1,NTMBZeekanaal,elektrische bevissing,NTMB,riet
INBO:AQ:216,24/06/2014,24/06/2014,24,06,2014,2014-06-24,Kanaal Brussel-Schelde,LO Lot,142638.982,161424.946,driedoornige stekelbaars,,,"Gasterosteus aculeatus
Linnaeus, 1758","Gasterosteus aculeatus
Linnaeus, 1758", ,31,,2,NTMBZeekanaal,elektrische bevissing,NTMB,riet
INBO:AQ:217,24/06/2014,24/06/2014,24,06,2014,2014-06-24,Kanaal Brussel-Schelde,LO Lot,142638.982,161424.946,driedoornige stekelbaars,,,"Gasterosteus aculeatus
Linnaeus, 1758","Gasterosteus aculeatus
Linnaeus, 1758", ,33,,1,NTMBZeekanaal,elektrische bevissing,NTMB,riet
INBO:AQ:218,24/06/2014,24/06/2014,24,06,2014,2014-06-24,Kanaal Brussel-Schelde,LO Lot,142638.982,161424.946,driedoornige stekelbaars,,,"Gasterosteus aculeatus
Linnaeus, 1758","Gasterosteus aculeatus
Linnaeus, 1758", ,34,,1,NTMBZeekanaal,elektrische bevissing,NTMB,riet
INBO:AQ:219,24/06/2014,24/06/2014,24,06,2014,2014-06-24,Kanaal Brussel-Schelde,LO Lot,142638.982,161424.946,driedoornige stekelbaars,,,"Gasterosteus aculeatus
Linnaeus, 1758","Gasterosteus aculeatus
Linnaeus, 1758", ,35,,1,NTMBZeekanaal,elektrische bevissing,NTMB,riet
INBO:AQ:220,22/07/2014,22/07/2014,22,07,2014,2014-07-22,Kanaal Brussel-Schelde,LO Grimbergen 4a,152143.521,183945.43,driedoornige stekelbaars,,,"Gasterosteus aculeatus
Linnaeus, 1758","Gasterosteus aculeatus
Linnaeus, 1758", ,30,,1,NTMBZeekanaal,elektrische bevissing,NTMB,breuksteen
INBO:AQ:221,23/07/2014,23/07/2014,23,07,2014,2014-07-23,Kanaal Brussel-Schelde,RO Wintam zone 1,145583.319,200539.564,driedoornige stekelbaars,,,"Gasterosteus aculeatus
Linnaeus, 1758","Gasterosteus aculeatus
Linnaeus, 1758", ,25,,1,NTMBZeekanaal,elektrische bevissing,NTMB,moerasvegetaties
INBO:AQ:222,23/07/2014,23/07/2014,23,07,2014,2014-07-23,Kanaal Brussel-Schelde,RO Wintam zone 2,145327.264,200389.792,driedoornige stekelbaars,,,"Gasterosteus aculeatus
Linnaeus, 1758","Gasterosteus aculeatus
Linnaeus, 1758", ,35,,1,NTMBZeekanaal,elektrische bevissing,NTMB,moerasvegetaties
INBO:AQ:223,23/07/2014,23/07/2014,23,07,2014,2014-07-23,Kanaal Brussel-Schelde,RO Wintam zone 3,145322.009,200218.122,driedoornige stekelbaars,,,"Gasterosteus aculeatus
Linnaeus, 1758","Gasterosteus aculeatus
Linnaeus, 1758", ,25,,2,NTMBZeekanaal,elektrische bevissing,NTMB,moerasvegetaties
INBO:AQ:224,23/07/2014,23/07/2014,23,07,2014,2014-07-23,Kanaal Brussel-Schelde,RO Wintam zone 3,145322.009,200218.122,driedoornige stekelbaars,,,"Gasterosteus aculeatus
Linnaeus, 1758","Gasterosteus aculeatus
Linnaeus, 1758", ,30,,7,NTMBZeekanaal,elektrische bevissing,NTMB,moerasvegetaties
INBO:AQ:225,23/07/2014,23/07/2014,23,07,2014,2014-07-23,Kanaal Brussel-Schelde,RO Wintam zone 3,145322.009,200218.122,driedoornige stekelbaars,,,"Gasterosteus aculeatus
Linnaeus, 1758","Gasterosteus aculeatus
Linnaeus, 1758", ,35,,1,NTMBZeekanaal,elektrische bevissing,NTMB,moerasvegetaties
INBO:AQ:226,23/07/2014,23/07/2014,23,07,2014,2014-07-23,Kanaal Brussel-Schelde,RO Wintam,145328.14,200090.246,driedoornige stekelbaars,,,"Gasterosteus aculeatus
Linnaeus, 1758","Gasterosteus aculeatus
Linnaeus, 1758", ,20,,1,NTMBZeekanaal,elektrische bevissing,NTMB,riet
INBO:AQ:227,23/07/2014,23/07/2014,23,07,2014,2014-07-23,Kanaal Brussel-Schelde,RO Wintam,145328.14,200090.246,driedoornige stekelbaars,,,"Gasterosteus aculeatus
Linnaeus, 1758","Gasterosteus aculeatus
Linnaeus, 1758", ,30,,1,NTMBZeekanaal,elektrische bevissing,NTMB,riet
INBO:AQ:228,23/07/2014,23/07/2014,23,07,2014,2014-07-23,Kanaal Brussel-Schelde,LO Lot,142638.982,161424.946,driedoornige stekelbaars,,,"Gasterosteus aculeatus
Linnaeus, 1758","Gasterosteus aculeatus
Linnaeus, 1758", ,30,,1,NTMBZeekanaal,elektrische bevissing,NTMB,riet
INBO:AQ:229,1/09/2014,1/09/2014,01,09,2014,2014-09-01,Kanaal Brussel-Schelde,LO Grimbergen,151843.59,184560.438,pos,Pos,,"Gymnocephalus cernuus (Linnaeus, 1758)",Erythrina pisamo Pos.-Arang., ,80,,1,NTMBZeekanaal,elektrische bevissing,VVO,betonnen kopbalk
INBO:AQ:230,2/09/2014,2/09/2014,02,09,2014,2014-09-02,Kanaal Brussel-Schelde,RO Grimbergen zone 2,152073.166,184314.048,pos,Pos,,"Gymnocephalus cernuus (Linnaeus, 1758)",Erythrina pisamo Pos.-Arang., ,71,,1,NTMBZeekanaal,schietfuiken,NTMB,afkalvende oever
INBO:AQ:231,4/09/2014,4/09/2014,04,09,2014,2014-09-04,Kanaal Brussel-Schelde,LO Lot,142638.982,161424.946,pos,Pos,,"Gymnocephalus cernuus (Linnaeus, 1758)",Erythrina pisamo Pos.-Arang., ,126,,1,NTMBZeekanaal,schietfuiken,NTMB,riet
INBO:AQ:232,23/06/2015,23/06/2015,23,06,2015,2015-06-23,Kanaal Leuven-Dijle,LO Aarschot,173757.68,176640.121,pos,Pos,,"Gymnocephalus cernuus (Linnaeus, 1758)",Erythrina pisamo Pos.-Arang., ,78,,2,NTMBZeekanaal,elektrische bevissing,VVO,schanskorven
INBO:AQ:233,23/06/2015,23/06/2015,23,06,2015,2015-06-23,Kanaal Leuven-Dijle,LO Herent,171334.748,180467.176,pos,Pos,,"Gymnocephalus cernuus (Linnaeus, 1758)",Erythrina pisamo Pos.-Arang., ,29,,2,NTMBZeekanaal,elektrische bevissing,NTMB,moerasvegetaties
INBO:AQ:234,23/06/2015,23/06/2015,23,06,2015,2015-06-23,Kanaal Leuven-Dijle,LO Herent,171334.748,180467.176,pos,Pos,,"Gymnocephalus cernuus (Linnaeus, 1758)",Erythrina pisamo Pos.-Arang., ,32,,1,NTMBZeekanaal,elektrische bevissing,NTMB,moerasvegetaties
INBO:AQ:235,23/06/2015,23/06/2015,23,06,2015,2015-06-23,Kanaal Leuven-Dijle,LO Herent,171334.748,180467.176,pos,Pos,,"Gymnocephalus cernuus (Linnaeus, 1758)",Erythrina pisamo Pos.-Arang., ,33,,1,NTMBZeekanaal,elektrische bevissing,NTMB,moerasvegetaties
INBO:AQ:236,23/06/2015,23/06/2015,23,06,2015,2015-06-23,Kanaal Leuven-Dijle,LO Herent,171334.748,180467.176,pos,Pos,,"Gymnocephalus cernuus (Linnaeus, 1758)",Erythrina pisamo Pos.-Arang., ,34,,3,NTMBZeekanaal,elektrische bevissing,NTMB,moerasvegetaties
INBO:AQ:237,23/06/2015,23/06/2015,23,06,2015,2015-06-23,Kanaal Leuven-Dijle,LO Herent,171574.844,180330.681,pos,Pos,,"Gymnocephalus cernuus (Linnaeus, 1758)",Erythrina pisamo Pos.-Arang., ,113,,1,NTMBZeekanaal,elektrische bevissing,VVO,schanskorven
INBO:AQ:238,28/07/2015,28/07/2015,28,07,2015,2015-07-28,Kanaal Leuven-Dijle,LO Aarschot,173757.68,176640.121,pos,Pos,,"Gymnocephalus cernuus (Linnaeus, 1758)",Erythrina pisamo Pos.-Arang., ,51,,1,NTMBZeekanaal,elektrische bevissing,VVO,schanskorven
INBO:AQ:239,3/09/2015,3/09/2015,03,09,2015,2015-09-03,Kanaal Leuven-Dijle,RO Aarschot,173789.027,176616.544,pos,Pos,,"Gymnocephalus cernuus (Linnaeus, 1758)",Erythrina pisamo Pos.-Arang., ,51,,1,NTMBZeekanaal,elektrische bevissing,NTMB,riet
INBO:AQ:240,3/09/2015,3/09/2015,03,09,2015,2015-09-03,Kanaal Leuven-Dijle,RO Aarschot,173789.027,176616.544,pos,Pos,,"Gymnocephalus cernuus (Linnaeus, 1758)",Erythrina pisamo Pos.-Arang., ,59,,1,NTMBZeekanaal,elektrische bevissing,NTMB,riet
INBO:AQ:241,3/09/2015,3/09/2015,03,09,2015,2015-09-03,Kanaal Leuven-Dijle,RO Aarschot,173789.027,176616.544,pos,Pos,,"Gymnocephalus cernuus (Linnaeus, 1758)",Erythrina pisamo Pos.-Arang., ,64,,1,NTMBZeekanaal,elektrische bevissing,NTMB,riet
INBO:AQ:242,3/09/2015,3/09/2015,03,09,2015,2015-09-03,Kanaal Leuven-Dijle,RO Aarschot,173783.816,176541.299,pos,Pos,,"Gymnocephalus cernuus (Linnaeus, 1758)",Erythrina pisamo Pos.-Arang., ,48,,1,NTMBZeekanaal,elektrische bevissing,VVO,riet
INBO:AQ:243,3/09/2015,3/09/2015,03,09,2015,2015-09-03,Kanaal Leuven-Dijle,LO Aarschot,173757.68,176640.121,pos,Pos,,"Gymnocephalus cernuus (Linnaeus, 1758)",Erythrina pisamo Pos.-Arang., ,61,,1,NTMBZeekanaal,elektrische bevissing,VVO,schanskorven
INBO:AQ:244,4/09/2015,4/09/2015,04,09,2015,2015-09-04,Kanaal Leuven-Dijle,LO Herent,171574.844,180330.681,pos,Pos,,"Gymnocephalus cernuus (Linnaeus, 1758)",Erythrina pisamo Pos.-Arang., ,62,,2,NTMBZeekanaal,elektrische bevissing,VVO,schanskorven
INBO:AQ:245,4/09/2015,4/09/2015,04,09,2015,2015-09-04,Kanaal Leuven-Dijle,LO Herent,171574.844,180330.681,pos,Pos,,"Gymnocephalus cernuus (Linnaeus, 1758)",Erythrina pisamo Pos.-Arang., ,74,,1,NTMBZeekanaal,elektrische bevissing,VVO,schanskorven
INBO:AQ:246,23/07/2014,23/07/2014,23,07,2014,2014-07-23,Kanaal Brussel-Schelde,RO Wintam zone 2,145327.264,200389.792,winde x kopvoorn,,,,, ,75,,1,NTMBZeekanaal,elektrische bevissing,NTMB,moerasvegetaties
INBO:AQ:247,23/06/2014,23/06/2014,23,06,2014,2014-06-23,Kanaal Brussel-Schelde,LO Grimbergen zone 4b_A,152539.338,183111.462,zonnebaars,Zonnebaars,,"Lepomis gibbosus (Linnaeus, 1758)","Lepomis gibbosus (Linnaeus, 1758)", ,60,,1,NTMBZeekanaal,elektrische bevissing,NTMB,breuksteen
INBO:AQ:248,23/06/2014,23/06/2014,23,06,2014,2014-06-23,Kanaal Brussel-Schelde,LO Grimbergen zone 4b_B,152257.821,183714.713,zonnebaars,Zonnebaars,,"Lepomis gibbosus (Linnaeus, 1758)","Lepomis gibbosus (Linnaeus, 1758)", ,60,,1,NTMBZeekanaal,elektrische bevissing,NTMB,breuksteen
INBO:AQ:249,23/06/2014,23/06/2014,23,06,2014,2014-06-23,Kanaal Brussel-Schelde,LO Grimbergen zone 4a,152143.521,183945.43,zonnebaars,Zonnebaars,,"Lepomis gibbosus (Linnaeus, 1758)","Lepomis gibbosus (Linnaeus, 1758)", ,100,,1,NTMBZeekanaal,elektrische bevissing,NTMB,breuksteen
INBO:AQ:250,23/06/2014,23/06/2014,23,06,2014,2014-06-23,Kanaal Brussel-Schelde,LO Grimbergen zone 4a,152143.521,183945.43,zonnebaars,Zonnebaars,,"Lepomis gibbosus (Linnaeus, 1758)","Lepomis gibbosus (Linnaeus, 1758)", ,140,,1,NTMBZeekanaal,elektrische bevissing,NTMB,breuksteen
INBO:AQ:251,22/07/2014,22/07/2014,22,07,2014,2014-07-22,Kanaal Brussel-Schelde,LO Grimbergen zone 4b_A,152539.338,183111.462,zonnebaars,Zonnebaars,,"Lepomis gibbosus (Linnaeus, 1758)","Lepomis gibbosus (Linnaeus, 1758)", ,80,,1,NTMBZeekanaal,elektrische bevissing,NTMB,breuksteen
INBO:AQ:252,22/07/2014,22/07/2014,22,07,2014,2014-07-22,Kanaal Brussel-Schelde,LO Grimbergen zone 4b_B,152257.821,183714.713,zonnebaars,Zonnebaars,,"Lepomis gibbosus (Linnaeus, 1758)","Lepomis gibbosus (Linnaeus, 1758)", ,75,,1,NTMBZeekanaal,elektrische bevissing,NTMB,breuksteen
INBO:AQ:253,22/07/2014,22/07/2014,22,07,2014,2014-07-22,Kanaal Brussel-Schelde,LO Grimbergen zone 4b_B,152257.821,183714.713,zonnebaars,Zonnebaars,,"Lepomis gibbosus (Linnaeus, 1758)","Lepomis gibbosus (Linnaeus, 1758)", ,90,,1,NTMBZeekanaal,elektrische bevissing,NTMB,breuksteen
INBO:AQ:254,2/09/2014,2/09/2014,02,09,2014,2014-09-02,Kanaal Brussel-Schelde,LO Grimbergen 4a,152143.521,183945.43,zonnebaars,Zonnebaars,,"Lepomis gibbosus (Linnaeus, 1758)","Lepomis gibbosus (Linnaeus, 1758)", ,82,,1,NTMBZeekanaal,elektrische bevissing,NTMB,breuksteen
INBO:AQ:255,2/09/2014,2/09/2014,02,09,2014,2014-09-02,Kanaal Brussel-Schelde,LO Grimbergen 4a,152143.521,183945.43,zonnebaars,Zonnebaars,,"Lepomis gibbosus (Linnaeus, 1758)","Lepomis gibbosus (Linnaeus, 1758)", ,96,,1,NTMBZeekanaal,elektrische bevissing,NTMB,breuksteen
INBO:AQ:256,2/09/2014,2/09/2014,02,09,2014,2014-09-02,Kanaal Brussel-Schelde,LO Grimbergen 4a,152143.521,183945.43,zonnebaars,Zonnebaars,,"Lepomis gibbosus (Linnaeus, 1758)","Lepomis gibbosus (Linnaeus, 1758)", ,98,,1,NTMBZeekanaal,elektrische bevissing,NTMB,breuksteen
INBO:AQ:257,2/09/2014,2/09/2014,02,09,2014,2014-09-02,Kanaal Brussel-Schelde,LO Grimbergen 4a,152143.521,183945.43,zonnebaars,Zonnebaars,,"Lepomis gibbosus (Linnaeus, 1758)","Lepomis gibbosus (Linnaeus, 1758)", ,100,,2,NTMBZeekanaal,elektrische bevissing,NTMB,breuksteen
INBO:AQ:258,2/09/2014,2/09/2014,02,09,2014,2014-09-02,Kanaal Brussel-Schelde,LO Grimbergen 4a,152143.521,183945.43,zonnebaars,Zonnebaars,,"Lepomis gibbosus (Linnaeus, 1758)","Lepomis gibbosus (Linnaeus, 1758)", ,102,,1,NTMBZeekanaal,elektrische bevissing,NTMB,breuksteen
INBO:AQ:259,2/09/2014,2/09/2014,02,09,2014,2014-09-02,Kanaal Brussel-Schelde,RO Grimbergen zone 1,152032.155,184397.392,zonnebaars,Zonnebaars,,"Lepomis gibbosus (Linnaeus, 1758)","Lepomis gibbosus (Linnaeus, 1758)", ,92,,1,NTMBZeekanaal,schietfuiken,NTMB,houtige begroeiing
INBO:AQ:260,2/09/2014,2/09/2014,02,09,2014,2014-09-02,Kanaal Brussel-Schelde,RO Grimbergen zone 1,152032.155,184397.392,zonnebaars,Zonnebaars,,"Lepomis gibbosus (Linnaeus, 1758)","Lepomis gibbosus (Linnaeus, 1758)", ,96,,2,NTMBZeekanaal,schietfuiken,NTMB,houtige begroeiing
INBO:AQ:261,2/09/2014,2/09/2014,02,09,2014,2014-09-02,Kanaal Brussel-Schelde,RO Grimbergen zone 1,152032.155,184397.392,zonnebaars,Zonnebaars,,"Lepomis gibbosus (Linnaeus, 1758)","Lepomis gibbosus (Linnaeus, 1758)", ,98,,1,NTMBZeekanaal,schietfuiken,NTMB,houtige begroeiing
INBO:AQ:262,2/09/2014,2/09/2014,02,09,2014,2014-09-02,Kanaal Brussel-Schelde,RO Grimbergen zone 1,152032.155,184397.392,zonnebaars,Zonnebaars,,"Lepomis gibbosus (Linnaeus, 1758)","Lepomis gibbosus (Linnaeus, 1758)", ,107,,1,NTMBZeekanaal,schietfuiken,NTMB,houtige begroeiing
INBO:AQ:263,2/09/2014,2/09/2014,02,09,2014,2014-09-02,Kanaal Brussel-Schelde,RO Grimbergen zone 1,152032.155,184397.392,zonnebaars,Zonnebaars,,"Lepomis gibbosus (Linnaeus, 1758)","Lepomis gibbosus (Linnaeus, 1758)", ,118,,1,NTMBZeekanaal,schietfuiken,NTMB,houtige begroeiing
INBO:AQ:264,2/09/2014,2/09/2014,02,09,2014,2014-09-02,Kanaal Brussel-Schelde,LO Grimbergen zone 4b_A,152539.338,183111.462,zonnebaars,Zonnebaars,,"Lepomis gibbosus (Linnaeus, 1758)","Lepomis gibbosus (Linnaeus, 1758)", ,87,,1,NTMBZeekanaal,schietfuiken,NTMB,breuksteen
INBO:AQ:265,2/09/2014,2/09/2014,02,09,2014,2014-09-02,Kanaal Brussel-Schelde,LO Grimbergen zone 4b_A,152539.338,183111.462,zonnebaars,Zonnebaars,,"Lepomis gibbosus (Linnaeus, 1758)","Lepomis gibbosus (Linnaeus, 1758)", ,100,,1,NTMBZeekanaal,schietfuiken,NTMB,breuksteen
INBO:AQ:266,2/09/2014,2/09/2014,02,09,2014,2014-09-02,Kanaal Brussel-Schelde,LO Grimbergen zone 4b_A,152539.338,183111.462,zonnebaars,Zonnebaars,,"Lepomis gibbosus (Linnaeus, 1758)","Lepomis gibbosus (Linnaeus, 1758)", ,108,,1,NTMBZeekanaal,schietfuiken,NTMB,breuksteen
INBO:AQ:267,2/09/2014,2/09/2014,02,09,2014,2014-09-02,Kanaal Brussel-Schelde,LO Grimbergen zone 4b_B,152257.821,183714.713,zonnebaars,Zonnebaars,,"Lepomis gibbosus (Linnaeus, 1758)","Lepomis gibbosus (Linnaeus, 1758)", ,76,,1,NTMBZeekanaal,schietfuiken,NTMB,breuksteen
INBO:AQ:268,2/09/2014,2/09/2014,02,09,2014,2014-09-02,Kanaal Brussel-Schelde,LO Grimbergen zone 4b_B,152257.821,183714.713,zonnebaars,Zonnebaars,,"Lepomis gibbosus (Linnaeus, 1758)","Lepomis gibbosus (Linnaeus, 1758)", ,81,,1,NTMBZeekanaal,schietfuiken,NTMB,breuksteen
INBO:AQ:269,2/09/2014,2/09/2014,02,09,2014,2014-09-02,Kanaal Brussel-Schelde,LO Grimbergen zone 4b_B,152257.821,183714.713,zonnebaars,Zonnebaars,,"Lepomis gibbosus (Linnaeus, 1758)","Lepomis gibbosus (Linnaeus, 1758)", ,84,,1,NTMBZeekanaal,schietfuiken,NTMB,breuksteen
INBO:AQ:270,2/09/2014,2/09/2014,02,09,2014,2014-09-02,Kanaal Brussel-Schelde,LO Grimbergen zone 4b_B,152257.821,183714.713,zonnebaars,Zonnebaars,,"Lepomis gibbosus (Linnaeus, 1758)","Lepomis gibbosus (Linnaeus, 1758)", ,85,,2,NTMBZeekanaal,schietfuiken,NTMB,breuksteen
INBO:AQ:271,2/09/2014,2/09/2014,02,09,2014,2014-09-02,Kanaal Brussel-Schelde,LO Grimbergen zone 4b_B,152257.821,183714.713,zonnebaars,Zonnebaars,,"Lepomis gibbosus (Linnaeus, 1758)","Lepomis gibbosus (Linnaeus, 1758)", ,87,,1,NTMBZeekanaal,schietfuiken,NTMB,breuksteen
INBO:AQ:272,2/09/2014,2/09/2014,02,09,2014,2014-09-02,Kanaal Brussel-Schelde,LO Grimbergen zone 4b_B,152257.821,183714.713,zonnebaars,Zonnebaars,,"Lepomis gibbosus (Linnaeus, 1758)","Lepomis gibbosus (Linnaeus, 1758)", ,91,,1,NTMBZeekanaal,schietfuiken,NTMB,breuksteen
INBO:AQ:273,2/09/2014,2/09/2014,02,09,2014,2014-09-02,Kanaal Brussel-Schelde,LO Grimbergen zone 4b_B,152257.821,183714.713,zonnebaars,Zonnebaars,,"Lepomis gibbosus (Linnaeus, 1758)","Lepomis gibbosus (Linnaeus, 1758)", ,95,,1,NTMBZeekanaal,schietfuiken,NTMB,breuksteen
INBO:AQ:274,2/09/2014,2/09/2014,02,09,2014,2014-09-02,Kanaal Brussel-Schelde,LO Grimbergen zone 4a,152143.521,183945.43,zonnebaars,Zonnebaars,,"Lepomis gibbosus (Linnaeus, 1758)","Lepomis gibbosus (Linnaeus, 1758)", ,95,,1,NTMBZeekanaal,schietfuiken,NTMB,breuksteen
INBO:AQ:275,4/09/2014,4/09/2014,04,09,2014,2014-09-04,Kanaal Brussel-Schelde,RO Wintam zone 2,145327.264,200389.792,zonnebaars,Zonnebaars,,"Lepomis gibbosus (Linnaeus, 1758)","Lepomis gibbosus (Linnaeus, 1758)", ,55,,1,NTMBZeekanaal,schietfuiken,NTMB,moerasvegetaties
INBO:AQ:276,23/07/2014,23/07/2014,23,07,2014,2014-07-23,Kanaal Brussel-Schelde,RO Wintam zone 2,145327.264,200389.792,winde,Winde,,"Leuciscus idus (Linnaeus, 1758)",Convolvulus L., ,500,,1,NTMBZeekanaal,elektrische bevissing,NTMB,moerasvegetaties
INBO:AQ:277,4/09/2014,4/09/2014,04,09,2014,2014-09-04,Kanaal Brussel-Schelde,RO Wintam,145328.14,200090.246,winde,Winde,,"Leuciscus idus (Linnaeus, 1758)",Convolvulus L., ,475,,1,NTMBZeekanaal,schietfuiken,NTMB,riet
INBO:AQ:278,4/09/2014,4/09/2014,04,09,2014,2014-09-04,Kanaal Brussel-Schelde,LO Lot,142638.982,161424.946,winde,Winde,,"Leuciscus idus (Linnaeus, 1758)",Convolvulus L., ,165,,1,NTMBZeekanaal,schietfuiken,NTMB,riet
INBO:AQ:279,24/06/2014,24/06/2014,24,06,2014,2014-06-24,Kanaal Brussel-Schelde,RO Wintam zone 1,145583.319,200539.564,,,,,, ,70,,1,NTMBZeekanaal,elektrische bevissing,NTMB,moerasvegetaties
INBO:AQ:280,24/06/2014,24/06/2014,24,06,2014,2014-06-24,Kanaal Brussel-Schelde,RO Wintam zone 3,145322.009,200218.122,zwartbekgrondel,Zwartbekgrondel,,"Neogobius melanostomus (Pallas, 1814)","Neogobius melanostomus (Pallas, 1814)", ,60,,1,NTMBZeekanaal,elektrische bevissing,NTMB,moerasvegetaties
INBO:AQ:281,24/06/2014,24/06/2014,24,06,2014,2014-06-24,Kanaal Brussel-Schelde,RO Wintam zone 3,145322.009,200218.122,zwartbekgrondel,Zwartbekgrondel,,"Neogobius melanostomus (Pallas, 1814)","Neogobius melanostomus (Pallas, 1814)", ,90,,1,NTMBZeekanaal,elektrische bevissing,NTMB,moerasvegetaties
INBO:AQ:282,23/07/2014,23/07/2014,23,07,2014,2014-07-23,Kanaal Brussel-Schelde,RO Wintam zone 1,145583.319,200539.564,zwartbekgrondel,Zwartbekgrondel,,"Neogobius melanostomus (Pallas, 1814)","Neogobius melanostomus (Pallas, 1814)", ,20,,1,NTMBZeekanaal,elektrische bevissing,NTMB,moerasvegetaties
INBO:AQ:283,23/07/2014,23/07/2014,23,07,2014,2014-07-23,Kanaal Brussel-Schelde,RO Wintam zone 1,145583.319,200539.564,zwartbekgrondel,Zwartbekgrondel,,"Neogobius melanostomus (Pallas, 1814)","Neogobius melanostomus (Pallas, 1814)", ,25,,2,NTMBZeekanaal,elektrische bevissing,NTMB,moerasvegetaties
INBO:AQ:284,23/07/2014,23/07/2014,23,07,2014,2014-07-23,Kanaal Brussel-Schelde,RO Wintam zone 1,145583.319,200539.564,zwartbekgrondel,Zwartbekgrondel,,"Neogobius melanostomus (Pallas, 1814)","Neogobius melanostomus (Pallas, 1814)", ,30,,3,NTMBZeekanaal,elektrische bevissing,NTMB,moerasvegetaties
INBO:AQ:285,23/07/2014,23/07/2014,23,07,2014,2014-07-23,Kanaal Brussel-Schelde,RO Wintam zone 1,145583.319,200539.564,zwartbekgrondel,Zwartbekgrondel,,"Neogobius melanostomus (Pallas, 1814)","Neogobius melanostomus (Pallas, 1814)", ,40,,1,NTMBZeekanaal,elektrische bevissing,NTMB,moerasvegetaties
INBO:AQ:286,23/07/2014,23/07/2014,23,07,2014,2014-07-23,Kanaal Brussel-Schelde,RO Wintam zone 1,145583.319,200539.564,zwartbekgrondel,Zwartbekgrondel,,"Neogobius melanostomus (Pallas, 1814)","Neogobius melanostomus (Pallas, 1814)", ,42,,2,NTMBZeekanaal,elektrische bevissing,NTMB,moerasvegetaties
INBO:AQ:287,23/07/2014,23/07/2014,23,07,2014,2014-07-23,Kanaal Brussel-Schelde,RO Wintam zone 1,145583.319,200539.564,zwartbekgrondel,Zwartbekgrondel,,"Neogobius melanostomus (Pallas, 1814)","Neogobius melanostomus (Pallas, 1814)", ,43,,1,NTMBZeekanaal,elektrische bevissing,NTMB,moerasvegetaties
INBO:AQ:288,23/07/2014,23/07/2014,23,07,2014,2014-07-23,Kanaal Brussel-Schelde,RO Wintam zone 2,145327.264,200389.792,zwartbekgrondel,Zwartbekgrondel,,"Neogobius melanostomus (Pallas, 1814)","Neogobius melanostomus (Pallas, 1814)", ,50,,1,NTMBZeekanaal,elektrische bevissing,NTMB,moerasvegetaties
INBO:AQ:289,23/07/2014,23/07/2014,23,07,2014,2014-07-23,Kanaal Brussel-Schelde,RO Wintam zone 2,145327.264,200389.792,zwartbekgrondel,Zwartbekgrondel,,"Neogobius melanostomus (Pallas, 1814)","Neogobius melanostomus (Pallas, 1814)", ,85,,1,NTMBZeekanaal,elektrische bevissing,NTMB,moerasvegetaties
INBO:AQ:290,23/07/2014,23/07/2014,23,07,2014,2014-07-23,Kanaal Brussel-Schelde,RO Wintam zone 3,145322.009,200218.122,zwartbekgrondel,Zwartbekgrondel,,"Neogobius melanostomus (Pallas, 1814)","Neogobius melanostomus (Pallas, 1814)", ,35,,1,NTMBZeekanaal,elektrische bevissing,NTMB,moerasvegetaties
INBO:AQ:291,23/07/2014,23/07/2014,23,07,2014,2014-07-23,Kanaal Brussel-Schelde,RO Wintam,145328.14,200090.246,zwartbekgrondel,Zwartbekgrondel,,"Neogobius melanostomus (Pallas, 1814)","Neogobius melanostomus (Pallas, 1814)", ,110,,1,NTMBZeekanaal,elektrische bevissing,NTMB,riet
INBO:AQ:292,3/09/2014,3/09/2014,03,09,2014,2014-09-03,Kanaal Brussel-Schelde,RO Wintam zone 1,145583.319,200539.564,zwartbekgrondel,Zwartbekgrondel,,"Neogobius melanostomus (Pallas, 1814)","Neogobius melanostomus (Pallas, 1814)", ,22,,1,NTMBZeekanaal,elektrische bevissing,NTMB,breuksteen
INBO:AQ:293,3/09/2014,3/09/2014,03,09,2014,2014-09-03,Kanaal Brussel-Schelde,RO Wintam zone 1,145583.319,200539.564,zwartbekgrondel,Zwartbekgrondel,,"Neogobius melanostomus (Pallas, 1814)","Neogobius melanostomus (Pallas, 1814)", ,43,,1,NTMBZeekanaal,elektrische bevissing,NTMB,breuksteen
INBO:AQ:294,3/09/2014,3/09/2014,03,09,2014,2014-09-03,Kanaal Brussel-Schelde,RO Wintam zone 1,145583.319,200539.564,zwartbekgrondel,Zwartbekgrondel,,"Neogobius melanostomus (Pallas, 1814)","Neogobius melanostomus (Pallas, 1814)", ,44,,2,NTMBZeekanaal,elektrische bevissing,NTMB,breuksteen
INBO:AQ:295,3/09/2014,3/09/2014,03,09,2014,2014-09-03,Kanaal Brussel-Schelde,RO Wintam zone 1,145583.319,200539.564,zwartbekgrondel,Zwartbekgrondel,,"Neogobius melanostomus (Pallas, 1814)","Neogobius melanostomus (Pallas, 1814)", ,50,,1,NTMBZeekanaal,elektrische bevissing,NTMB,breuksteen
INBO:AQ:296,3/09/2014,3/09/2014,03,09,2014,2014-09-03,Kanaal Brussel-Schelde,RO Wintam zone 1,145583.319,200539.564,zwartbekgrondel,Zwartbekgrondel,,"Neogobius melanostomus (Pallas, 1814)","Neogobius melanostomus (Pallas, 1814)", ,52,,1,NTMBZeekanaal,elektrische bevissing,NTMB,breuksteen
INBO:AQ:297,3/09/2014,3/09/2014,03,09,2014,2014-09-03,Kanaal Brussel-Schelde,RO Wintam zone 1,145583.319,200539.564,zwartbekgrondel,Zwartbekgrondel,,"Neogobius melanostomus (Pallas, 1814)","Neogobius melanostomus (Pallas, 1814)", ,60,,1,NTMBZeekanaal,elektrische bevissing,NTMB,breuksteen
INBO:AQ:298,3/09/2014,3/09/2014,03,09,2014,2014-09-03,Kanaal Brussel-Schelde,RO Wintam zone 1,145583.319,200539.564,zwartbekgrondel,Zwartbekgrondel,,"Neogobius melanostomus (Pallas, 1814)","Neogobius melanostomus (Pallas, 1814)", ,70,,2,NTMBZeekanaal,elektrische bevissing,NTMB,breuksteen
INBO:AQ:299,3/09/2014,3/09/2014,03,09,2014,2014-09-03,Kanaal Brussel-Schelde,RO Wintam zone 1,145583.319,200539.564,zwartbekgrondel,Zwartbekgrondel,,"Neogobius melanostomus (Pallas, 1814)","Neogobius melanostomus (Pallas, 1814)", ,71,,2,NTMBZeekanaal,elektrische bevissing,NTMB,breuksteen
INBO:AQ:300,3/09/2014,3/09/2014,03,09,2014,2014-09-03,Kanaal Brussel-Schelde,RO Wintam zone 1,145583.319,200539.564,zwartbekgrondel,Zwartbekgrondel,,"Neogobius melanostomus (Pallas, 1814)","Neogobius melanostomus (Pallas, 1814)", ,72,,1,NTMBZeekanaal,elektrische bevissing,NTMB,breuksteen
INBO:AQ:301,3/09/2014,3/09/2014,03,09,2014,2014-09-03,Kanaal Brussel-Schelde,RO Wintam zone 1,145583.319,200539.564,zwartbekgrondel,Zwartbekgrondel,,"Neogobius melanostomus (Pallas, 1814)","Neogobius melanostomus (Pallas, 1814)", ,73,,1,NTMBZeekanaal,elektrische bevissing,NTMB,breuksteen
INBO:AQ:302,3/09/2014,3/09/2014,03,09,2014,2014-09-03,Kanaal Brussel-Schelde,RO Wintam zone 1,145583.319,200539.564,zwartbekgrondel,Zwartbekgrondel,,"Neogobius melanostomus (Pallas, 1814)","Neogobius melanostomus (Pallas, 1814)", ,77,,1,NTMBZeekanaal,elektrische bevissing,NTMB,breuksteen
INBO:AQ:303,3/09/2014,3/09/2014,03,09,2014,2014-09-03,Kanaal Brussel-Schelde,RO Wintam zone 1,145583.319,200539.564,zwartbekgrondel,Zwartbekgrondel,,"Neogobius melanostomus (Pallas, 1814)","Neogobius melanostomus (Pallas, 1814)", ,84,,1,NTMBZeekanaal,elektrische bevissing,NTMB,breuksteen
INBO:AQ:304,3/09/2014,3/09/2014,03,09,2014,2014-09-03,Kanaal Brussel-Schelde,RO Wintam zone 1,145583.319,200539.564,zwartbekgrondel,Zwartbekgrondel,,"Neogobius melanostomus (Pallas, 1814)","Neogobius melanostomus (Pallas, 1814)", ,93,,1,NTMBZeekanaal,elektrische bevissing,NTMB,breuksteen
INBO:AQ:305,3/09/2014,3/09/2014,03,09,2014,2014-09-03,Kanaal Brussel-Schelde,RO Wintam zone 2,145327.264,200389.792,zwartbekgrondel,Zwartbekgrondel,,"Neogobius melanostomus (Pallas, 1814)","Neogobius melanostomus (Pallas, 1814)", ,65,,1,NTMBZeekanaal,elektrische bevissing,NTMB,breuksteen
INBO:AQ:306,3/09/2014,3/09/2014,03,09,2014,2014-09-03,Kanaal Brussel-Schelde,RO Wintam zone 2,145327.264,200389.792,zwartbekgrondel,Zwartbekgrondel,,"Neogobius melanostomus (Pallas, 1814)","Neogobius melanostomus (Pallas, 1814)", ,66,,1,NTMBZeekanaal,elektrische bevissing,NTMB,breuksteen
INBO:AQ:307,3/09/2014,3/09/2014,03,09,2014,2014-09-03,Kanaal Brussel-Schelde,RO Wintam zone 2,145327.264,200389.792,zwartbekgrondel,Zwartbekgrondel,,"Neogobius melanostomus (Pallas, 1814)","Neogobius melanostomus (Pallas, 1814)", ,72,,1,NTMBZeekanaal,elektrische bevissing,NTMB,breuksteen
INBO:AQ:308,3/09/2014,3/09/2014,03,09,2014,2014-09-03,Kanaal Brussel-Schelde,RO Wintam zone 2,145327.264,200389.792,zwartbekgrondel,Zwartbekgrondel,,"Neogobius melanostomus (Pallas, 1814)","Neogobius melanostomus (Pallas, 1814)", ,75,,1,NTMBZeekanaal,elektrische bevissing,NTMB,breuksteen
INBO:AQ:309,3/09/2014,3/09/2014,03,09,2014,2014-09-03,Kanaal Brussel-Schelde,RO Wintam zone 2,145327.264,200389.792,zwartbekgrondel,Zwartbekgrondel,,"Neogobius melanostomus (Pallas, 1814)","Neogobius melanostomus (Pallas, 1814)", ,76,,1,NTMBZeekanaal,elektrische bevissing,NTMB,breuksteen
INBO:AQ:310,3/09/2014,3/09/2014,03,09,2014,2014-09-03,Kanaal Brussel-Schelde,RO Wintam zone 2,145327.264,200389.792,zwartbekgrondel,Zwartbekgrondel,,"Neogobius melanostomus (Pallas, 1814)","Neogobius melanostomus (Pallas, 1814)", ,81,,1,NTMBZeekanaal,elektrische bevissing,NTMB,breuksteen
INBO:AQ:311,3/09/2014,3/09/2014,03,09,2014,2014-09-03,Kanaal Brussel-Schelde,RO Wintam zone 2,145327.264,200389.792,zwartbekgrondel,Zwartbekgrondel,,"Neogobius melanostomus (Pallas, 1814)","Neogobius melanostomus (Pallas, 1814)", ,83,,1,NTMBZeekanaal,elektrische bevissing,NTMB,breuksteen
INBO:AQ:312,3/09/2014,3/09/2014,03,09,2014,2014-09-03,Kanaal Brussel-Schelde,RO Wintam zone 2,145327.264,200389.792,zwartbekgrondel,Zwartbekgrondel,,"Neogobius melanostomus (Pallas, 1814)","Neogobius melanostomus (Pallas, 1814)", ,85,,1,NTMBZeekanaal,elektrische bevissing,NTMB,breuksteen
INBO:AQ:313,3/09/2014,3/09/2014,03,09,2014,2014-09-03,Kanaal Brussel-Schelde,RO Wintam zone 3,145322.009,200218.122,zwartbekgrondel,Zwartbekgrondel,,"Neogobius melanostomus (Pallas, 1814)","Neogobius melanostomus (Pallas, 1814)", ,38,,1,NTMBZeekanaal,elektrische bevissing,NTMB,breuksteen
INBO:AQ:314,3/09/2014,3/09/2014,03,09,2014,2014-09-03,Kanaal Brussel-Schelde,RO Wintam zone 3,145322.009,200218.122,zwartbekgrondel,Zwartbekgrondel,,"Neogobius melanostomus (Pallas, 1814)","Neogobius melanostomus (Pallas, 1814)", ,40,,1,NTMBZeekanaal,elektrische bevissing,NTMB,breuksteen
INBO:AQ:315,3/09/2014,3/09/2014,03,09,2014,2014-09-03,Kanaal Brussel-Schelde,RO Wintam zone 3,145322.009,200218.122,zwartbekgrondel,Zwartbekgrondel,,"Neogobius melanostomus (Pallas, 1814)","Neogobius melanostomus (Pallas, 1814)", ,42,,2,NTMBZeekanaal,elektrische bevissing,NTMB,breuksteen
INBO:AQ:316,3/09/2014,3/09/2014,03,09,2014,2014-09-03,Kanaal Brussel-Schelde,RO Wintam zone 3,145322.009,200218.122,zwartbekgrondel,Zwartbekgrondel,,"Neogobius melanostomus (Pallas, 1814)","Neogobius melanostomus (Pallas, 1814)", ,60,,1,NTMBZeekanaal,elektrische bevissing,NTMB,breuksteen
INBO:AQ:317,3/09/2014,3/09/2014,03,09,2014,2014-09-03,Kanaal Brussel-Schelde,RO Wintam zone 3,145322.009,200218.122,zwartbekgrondel,Zwartbekgrondel,,"Neogobius melanostomus (Pallas, 1814)","Neogobius melanostomus (Pallas, 1814)", ,65,,1,NTMBZeekanaal,elektrische bevissing,NTMB,breuksteen
INBO:AQ:318,3/09/2014,3/09/2014,03,09,2014,2014-09-03,Kanaal Brussel-Schelde,RO Wintam zone 3,145322.009,200218.122,zwartbekgrondel,Zwartbekgrondel,,"Neogobius melanostomus (Pallas, 1814)","Neogobius melanostomus (Pallas, 1814)", ,75,,1,NTMBZeekanaal,elektrische bevissing,NTMB,breuksteen
INBO:AQ:319,3/09/2014,3/09/2014,03,09,2014,2014-09-03,Kanaal Brussel-Schelde,RO Wintam,145328.14,200090.246,zwartbekgrondel,Zwartbekgrondel,,"Neogobius melanostomus (Pallas, 1814)","Neogobius melanostomus (Pallas, 1814)", ,41,,1,NTMBZeekanaal,elektrische bevissing,NTMB,riet
INBO:AQ:320,3/09/2014,3/09/2014,03,09,2014,2014-09-03,Kanaal Brussel-Schelde,RO Wintam,145328.14,200090.246,zwartbekgrondel,Zwartbekgrondel,,"Neogobius melanostomus (Pallas, 1814)","Neogobius melanostomus (Pallas, 1814)", ,55,,2,NTMBZeekanaal,elektrische bevissing,NTMB,riet
INBO:AQ:321,3/09/2014,3/09/2014,03,09,2014,2014-09-03,Kanaal Brussel-Schelde,RO Wintam,145328.14,200090.246,zwartbekgrondel,Zwartbekgrondel,,"Neogobius melanostomus (Pallas, 1814)","Neogobius melanostomus (Pallas, 1814)", ,56,,1,NTMBZeekanaal,elektrische bevissing,NTMB,riet
INBO:AQ:322,3/09/2014,3/09/2014,03,09,2014,2014-09-03,Kanaal Brussel-Schelde,RO Wintam,145328.14,200090.246,zwartbekgrondel,Zwartbekgrondel,,"Neogobius melanostomus (Pallas, 1814)","Neogobius melanostomus (Pallas, 1814)", ,67,,1,NTMBZeekanaal,elektrische bevissing,NTMB,riet
INBO:AQ:323,3/09/2014,3/09/2014,03,09,2014,2014-09-03,Kanaal Brussel-Schelde,RO Wintam,145328.14,200090.246,zwartbekgrondel,Zwartbekgrondel,,"Neogobius melanostomus (Pallas, 1814)","Neogobius melanostomus (Pallas, 1814)", ,75,,1,NTMBZeekanaal,elektrische bevissing,NTMB,riet
INBO:AQ:324,3/09/2014,3/09/2014,03,09,2014,2014-09-03,Kanaal Brussel-Schelde,RO Wintam,145328.14,200090.246,zwartbekgrondel,Zwartbekgrondel,,"Neogobius melanostomus (Pallas, 1814)","Neogobius melanostomus (Pallas, 1814)", ,85,,1,NTMBZeekanaal,elektrische bevissing,NTMB,riet
INBO:AQ:325,3/09/2014,3/09/2014,03,09,2014,2014-09-03,Kanaal Brussel-Schelde,RO Wintam,145328.14,200090.246,zwartbekgrondel,Zwartbekgrondel,,"Neogobius melanostomus (Pallas, 1814)","Neogobius melanostomus (Pallas, 1814)", ,87,,1,NTMBZeekanaal,elektrische bevissing,NTMB,riet
INBO:AQ:326,3/09/2014,3/09/2014,03,09,2014,2014-09-03,Kanaal Brussel-Schelde,RO Wintam,145328.14,200090.246,zwartbekgrondel,Zwartbekgrondel,,"Neogobius melanostomus (Pallas, 1814)","Neogobius melanostomus (Pallas, 1814)", ,96,,1,NTMBZeekanaal,elektrische bevissing,NTMB,riet
INBO:AQ:327,4/09/2014,4/09/2014,04,09,2014,2014-09-04,Kanaal Brussel-Schelde,RO Wintam,143396.457,199875.659,zwartbekgrondel,Zwartbekgrondel,,"Neogobius melanostomus (Pallas, 1814)","Neogobius melanostomus (Pallas, 1814)", ,81,,1,NTMBZeekanaal,schietfuiken,VVO,betonnen kopbalk
INBO:AQ:328,4/09/2014,4/09/2014,04,09,2014,2014-09-04,Kanaal Brussel-Schelde,RO Wintam,143396.457,199875.659,zwartbekgrondel,Zwartbekgrondel,,"Neogobius melanostomus (Pallas, 1814)","Neogobius melanostomus (Pallas, 1814)", ,96,,1,NTMBZeekanaal,schietfuiken,VVO,betonnen kopbalk
INBO:AQ:329,4/09/2014,4/09/2014,04,09,2014,2014-09-04,Kanaal Brussel-Schelde,RO Wintam,143396.457,199875.659,zwartbekgrondel,Zwartbekgrondel,,"Neogobius melanostomus (Pallas, 1814)","Neogobius melanostomus (Pallas, 1814)", ,136,,1,NTMBZeekanaal,schietfuiken,VVO,betonnen kopbalk
INBO:AQ:330,4/09/2014,4/09/2014,04,09,2014,2014-09-04,Kanaal Brussel-Schelde,RO Wintam zone 2,145327.264,200389.792,zwartbekgrondel,Zwartbekgrondel,,"Neogobius melanostomus (Pallas, 1814)","Neogobius melanostomus (Pallas, 1814)", ,83,,1,NTMBZeekanaal,schietfuiken,NTMB,moerasvegetaties
INBO:AQ:331,4/09/2014,4/09/2014,04,09,2014,2014-09-04,Kanaal Brussel-Schelde,RO Wintam zone 2,145327.264,200389.792,zwartbekgrondel,Zwartbekgrondel,,"Neogobius melanostomus (Pallas, 1814)","Neogobius melanostomus (Pallas, 1814)", ,113,,1,NTMBZeekanaal,schietfuiken,NTMB,moerasvegetaties
INBO:AQ:332,23/06/2014,23/06/2014,23,06,2014,2014-06-23,Kanaal Brussel-Schelde,RO Grimbergen,151952.138,184548.152,baars,Baars,,"Perca fluviatilis Linnaeus, 1758","Kansaphyllum D.L. Baars, 1992", ,60,,1,NTMBZeekanaal,elektrische bevissing,VVO,schanskorven
INBO:AQ:333,23/06/2014,23/06/2014,23,06,2014,2014-06-23,Kanaal Brussel-Schelde,RO Grimbergen zone 1,152032.155,184397.392,baars,Baars,,"Perca fluviatilis Linnaeus, 1758","Kansaphyllum D.L. Baars, 1992", ,60,,2,NTMBZeekanaal,elektrische bevissing,NTMB,houtige begroeiing
INBO:AQ:334,23/06/2014,23/06/2014,23,06,2014,2014-06-23,Kanaal Brussel-Schelde,RO Grimbergen zone 1,152032.155,184397.392,baars,Baars,,"Perca fluviatilis Linnaeus, 1758","Kansaphyllum D.L. Baars, 1992", ,130,,1,NTMBZeekanaal,elektrische bevissing,NTMB,houtige begroeiing
INBO:AQ:335,23/06/2014,23/06/2014,23,06,2014,2014-06-23,Kanaal Brussel-Schelde,RO Grimbergen zone 1,152032.155,184397.392,baars,Baars,,"Perca fluviatilis Linnaeus, 1758","Kansaphyllum D.L. Baars, 1992", ,140,,1,NTMBZeekanaal,elektrische bevissing,NTMB,houtige begroeiing
INBO:AQ:336,23/06/2014,23/06/2014,23,06,2014,2014-06-23,Kanaal Brussel-Schelde,RO Grimbergen zone 1,152032.155,184397.392,baars,Baars,,"Perca fluviatilis Linnaeus, 1758","Kansaphyllum D.L. Baars, 1992", ,150,,1,NTMBZeekanaal,elektrische bevissing,NTMB,houtige begroeiing
INBO:AQ:337,23/06/2014,23/06/2014,23,06,2014,2014-06-23,Kanaal Brussel-Schelde,LO Grimbergen zone 4b_B,152257.821,183714.713,baars,Baars,,"Perca fluviatilis Linnaeus, 1758","Kansaphyllum D.L. Baars, 1992", ,120,,1,NTMBZeekanaal,elektrische bevissing,NTMB,breuksteen
INBO:AQ:338,23/06/2014,23/06/2014,23,06,2014,2014-06-23,Kanaal Brussel-Schelde,LO Grimbergen zone 4b_B,152257.821,183714.713,baars,Baars,,"Perca fluviatilis Linnaeus, 1758","Kansaphyllum D.L. Baars, 1992", ,140,,1,NTMBZeekanaal,elektrische bevissing,NTMB,breuksteen
INBO:AQ:339,23/06/2014,23/06/2014,23,06,2014,2014-06-23,Kanaal Brussel-Schelde,LO Grimbergen zone 4a,152143.521,183945.43,baars,Baars,,"Perca fluviatilis Linnaeus, 1758","Kansaphyllum D.L. Baars, 1992", ,50,,2,NTMBZeekanaal,elektrische bevissing,NTMB,breuksteen
INBO:AQ:340,23/06/2014,23/06/2014,23,06,2014,2014-06-23,Kanaal Brussel-Schelde,LO Grimbergen zone 4a,152143.521,183945.43,baars,Baars,,"Perca fluviatilis Linnaeus, 1758","Kansaphyllum D.L. Baars, 1992", ,58,,1,NTMBZeekanaal,elektrische bevissing,NTMB,breuksteen
INBO:AQ:341,23/06/2014,23/06/2014,23,06,2014,2014-06-23,Kanaal Brussel-Schelde,LO Grimbergen zone 4a,152143.521,183945.43,baars,Baars,,"Perca fluviatilis Linnaeus, 1758","Kansaphyllum D.L. Baars, 1992", ,60,,1,NTMBZeekanaal,elektrische bevissing,NTMB,breuksteen
INBO:AQ:342,23/06/2014,23/06/2014,23,06,2014,2014-06-23,Kanaal Brussel-Schelde,LO Grimbergen zone 4a,152143.521,183945.43,baars,Baars,,"Perca fluviatilis Linnaeus, 1758","Kansaphyllum D.L. Baars, 1992", ,140,,1,NTMBZeekanaal,elektrische bevissing,NTMB,breuksteen
INBO:AQ:343,24/06/2014,24/06/2014,24,06,2014,2014-06-24,Kanaal Brussel-Schelde,LO Lot,142617.889,161353.806,baars,Baars,,"Perca fluviatilis Linnaeus, 1758","Kansaphyllum D.L. Baars, 1992", ,40,,1,NTMBZeekanaal,elektrische bevissing,VVO,schanskorven
INBO:AQ:344,24/06/2014,24/06/2014,24,06,2014,2014-06-24,Kanaal Brussel-Schelde,LO Lot,142617.889,161353.806,baars,Baars,,"Perca fluviatilis Linnaeus, 1758","Kansaphyllum D.L. Baars, 1992", ,50,,1,NTMBZeekanaal,elektrische bevissing,VVO,schanskorven
INBO:AQ:345,24/06/2014,24/06/2014,24,06,2014,2014-06-24,Kanaal Brussel-Schelde,LO Lot,142617.889,161353.806,baars,Baars,,"Perca fluviatilis Linnaeus, 1758","Kansaphyllum D.L. Baars, 1992", ,150,,1,NTMBZeekanaal,elektrische bevissing,VVO,schanskorven
INBO:AQ:346,24/06/2014,24/06/2014,24,06,2014,2014-06-24,Kanaal Brussel-Schelde,LO Lot,142638.982,161424.946,baars,Baars,,"Perca fluviatilis Linnaeus, 1758","Kansaphyllum D.L. Baars, 1992", ,40,,1,NTMBZeekanaal,elektrische bevissing,NTMB,riet
INBO:AQ:347,24/06/2014,24/06/2014,24,06,2014,2014-06-24,Kanaal Brussel-Schelde,LO Lot,142638.982,161424.946,baars,Baars,,"Perca fluviatilis Linnaeus, 1758","Kansaphyllum D.L. Baars, 1992", ,45,,1,NTMBZeekanaal,elektrische bevissing,NTMB,riet
INBO:AQ:348,24/06/2014,24/06/2014,24,06,2014,2014-06-24,Kanaal Brussel-Schelde,LO Lot,142638.982,161424.946,baars,Baars,,"Perca fluviatilis Linnaeus, 1758","Kansaphyllum D.L. Baars, 1992", ,46,,1,NTMBZeekanaal,elektrische bevissing,NTMB,riet
INBO:AQ:349,24/06/2014,24/06/2014,24,06,2014,2014-06-24,Kanaal Brussel-Schelde,LO Lot,142638.982,161424.946,baars,Baars,,"Perca fluviatilis Linnaeus, 1758","Kansaphyllum D.L. Baars, 1992", ,49,,2,NTMBZeekanaal,elektrische bevissing,NTMB,riet
INBO:AQ:350,24/06/2014,24/06/2014,24,06,2014,2014-06-24,Kanaal Brussel-Schelde,LO Lot,142638.982,161424.946,baars,Baars,,"Perca fluviatilis Linnaeus, 1758","Kansaphyllum D.L. Baars, 1992", ,50,,4,NTMBZeekanaal,elektrische bevissing,NTMB,riet
INBO:AQ:351,24/06/2014,24/06/2014,24,06,2014,2014-06-24,Kanaal Brussel-Schelde,LO Lot,142638.982,161424.946,baars,Baars,,"Perca fluviatilis Linnaeus, 1758","Kansaphyllum D.L. Baars, 1992", ,130,,1,NTMBZeekanaal,elektrische bevissing,NTMB,riet
INBO:AQ:352,22/07/2014,22/07/2014,22,07,2014,2014-07-22,Kanaal Brussel-Schelde,RO Grimbergen,151854.082,184732.874,baars,Baars,,"Perca fluviatilis Linnaeus, 1758","Kansaphyllum D.L. Baars, 1992", ,80,,1,NTMBZeekanaal,elektrische bevissing,VVO,betonnen kopbalk
INBO:AQ:353,22/07/2014,22/07/2014,22,07,2014,2014-07-22,Kanaal Brussel-Schelde,RO Grimbergen,151952.138,184548.152,baars,Baars,,"Perca fluviatilis Linnaeus, 1758","Kansaphyllum D.L. Baars, 1992", ,75,,3,NTMBZeekanaal,elektrische bevissing,VVO,schanskorven
INBO:AQ:354,22/07/2014,22/07/2014,22,07,2014,2014-07-22,Kanaal Brussel-Schelde,LO Grimbergen zone 4b_A,152539.338,183111.462,baars,Baars,,"Perca fluviatilis Linnaeus, 1758","Kansaphyllum D.L. Baars, 1992", ,65,,1,NTMBZeekanaal,elektrische bevissing,NTMB,breuksteen
INBO:AQ:355,22/07/2014,22/07/2014,22,07,2014,2014-07-22,Kanaal Brussel-Schelde,LO Grimbergen zone 4b_A,152539.338,183111.462,baars,Baars,,"Perca fluviatilis Linnaeus, 1758","Kansaphyllum D.L. Baars, 1992", ,75,,2,NTMBZeekanaal,elektrische bevissing,NTMB,breuksteen
INBO:AQ:356,22/07/2014,22/07/2014,22,07,2014,2014-07-22,Kanaal Brussel-Schelde,LO Grimbergen zone 4b_A,152539.338,183111.462,baars,Baars,,"Perca fluviatilis Linnaeus, 1758","Kansaphyllum D.L. Baars, 1992", ,80,,2,NTMBZeekanaal,elektrische bevissing,NTMB,breuksteen
INBO:AQ:357,22/07/2014,22/07/2014,22,07,2014,2014-07-22,Kanaal Brussel-Schelde,LO Grimbergen zone 4b_A,152539.338,183111.462,baars,Baars,,"Perca fluviatilis Linnaeus, 1758","Kansaphyllum D.L. Baars, 1992", ,90,,3,NTMBZeekanaal,elektrische bevissing,NTMB,breuksteen
INBO:AQ:358,22/07/2014,22/07/2014,22,07,2014,2014-07-22,Kanaal Brussel-Schelde,LO Grimbergen zone 4b_A,152539.338,183111.462,baars,Baars,,"Perca fluviatilis Linnaeus, 1758","Kansaphyllum D.L. Baars, 1992", ,95,,1,NTMBZeekanaal,elektrische bevissing,NTMB,breuksteen
INBO:AQ:359,22/07/2014,22/07/2014,22,07,2014,2014-07-22,Kanaal Brussel-Schelde,LO Grimbergen zone 4b_A,152539.338,183111.462,baars,Baars,,"Perca fluviatilis Linnaeus, 1758","Kansaphyllum D.L. Baars, 1992", ,160,,1,NTMBZeekanaal,elektrische bevissing,NTMB,breuksteen
INBO:AQ:360,22/07/2014,22/07/2014,22,07,2014,2014-07-22,Kanaal Brussel-Schelde,LO Grimbergen zone 4b_B,152257.821,183714.713,baars,Baars,,"Perca fluviatilis Linnaeus, 1758","Kansaphyllum D.L. Baars, 1992", ,70,,4,NTMBZeekanaal,elektrische bevissing,NTMB,breuksteen
INBO:AQ:361,22/07/2014,22/07/2014,22,07,2014,2014-07-22,Kanaal Brussel-Schelde,LO Grimbergen zone 4b_B,152257.821,183714.713,baars,Baars,,"Perca fluviatilis Linnaeus, 1758","Kansaphyllum D.L. Baars, 1992", ,80,,1,NTMBZeekanaal,elektrische bevissing,NTMB,breuksteen
INBO:AQ:362,22/07/2014,22/07/2014,22,07,2014,2014-07-22,Kanaal Brussel-Schelde,LO Grimbergen zone 4b_B,152257.821,183714.713,baars,Baars,,"Perca fluviatilis Linnaeus, 1758","Kansaphyllum D.L. Baars, 1992", ,90,,1,NTMBZeekanaal,elektrische bevissing,NTMB,breuksteen
INBO:AQ:363,22/07/2014,22/07/2014,22,07,2014,2014-07-22,Kanaal Brussel-Schelde,LO Grimbergen zone 4b_B,152257.821,183714.713,baars,Baars,,"Perca fluviatilis Linnaeus, 1758","Kansaphyllum D.L. Baars, 1992", ,130,,2,NTMBZeekanaal,elektrische bevissing,NTMB,breuksteen
INBO:AQ:364,22/07/2014,22/07/2014,22,07,2014,2014-07-22,Kanaal Brussel-Schelde,LO Grimbergen zone 4b_B,152257.821,183714.713,baars,Baars,,"Perca fluviatilis Linnaeus, 1758","Kansaphyllum D.L. Baars, 1992", ,140,,1,NTMBZeekanaal,elektrische bevissing,NTMB,breuksteen
INBO:AQ:365,22/07/2014,22/07/2014,22,07,2014,2014-07-22,Kanaal Brussel-Schelde,LO Grimbergen zone 4b_B,152257.821,183714.713,baars,Baars,,"Perca fluviatilis Linnaeus, 1758","Kansaphyllum D.L. Baars, 1992", ,150,,2,NTMBZeekanaal,elektrische bevissing,NTMB,breuksteen
INBO:AQ:366,22/07/2014,22/07/2014,22,07,2014,2014-07-22,Kanaal Brussel-Schelde,LO Grimbergen zone 4b_B,152257.821,183714.713,baars,Baars,,"Perca fluviatilis Linnaeus, 1758","Kansaphyllum D.L. Baars, 1992", ,200,,1,NTMBZeekanaal,elektrische bevissing,NTMB,breuksteen
INBO:AQ:367,22/07/2014,22/07/2014,22,07,2014,2014-07-22,Kanaal Brussel-Schelde,LO Grimbergen 4a,152143.521,183945.43,baars,Baars,,"Perca fluviatilis Linnaeus, 1758","Kansaphyllum D.L. Baars, 1992", ,50,,1,NTMBZeekanaal,elektrische bevissing,NTMB,breuksteen
INBO:AQ:368,22/07/2014,22/07/2014,22,07,2014,2014-07-22,Kanaal Brussel-Schelde,LO Grimbergen 4a,152143.521,183945.43,baars,Baars,,"Perca fluviatilis Linnaeus, 1758","Kansaphyllum D.L. Baars, 1992", ,60,,1,NTMBZeekanaal,elektrische bevissing,NTMB,breuksteen
INBO:AQ:369,22/07/2014,22/07/2014,22,07,2014,2014-07-22,Kanaal Brussel-Schelde,LO Grimbergen 4a,152143.521,183945.43,baars,Baars,,"Perca fluviatilis Linnaeus, 1758","Kansaphyllum D.L. Baars, 1992", ,65,,1,NTMBZeekanaal,elektrische bevissing,NTMB,breuksteen
INBO:AQ:370,22/07/2014,22/07/2014,22,07,2014,2014-07-22,Kanaal Brussel-Schelde,LO Grimbergen 4a,152143.521,183945.43,baars,Baars,,"Perca fluviatilis Linnaeus, 1758","Kansaphyllum D.L. Baars, 1992", ,70,,6,NTMBZeekanaal,elektrische bevissing,NTMB,breuksteen
INBO:AQ:371,22/07/2014,22/07/2014,22,07,2014,2014-07-22,Kanaal Brussel-Schelde,LO Grimbergen 4a,152143.521,183945.43,baars,Baars,,"Perca fluviatilis Linnaeus, 1758","Kansaphyllum D.L. Baars, 1992", ,75,,2,NTMBZeekanaal,elektrische bevissing,NTMB,breuksteen
INBO:AQ:372,22/07/2014,22/07/2014,22,07,2014,2014-07-22,Kanaal Brussel-Schelde,LO Grimbergen 4a,152143.521,183945.43,baars,Baars,,"Perca fluviatilis Linnaeus, 1758","Kansaphyllum D.L. Baars, 1992", ,80,,12,NTMBZeekanaal,elektrische bevissing,NTMB,breuksteen
INBO:AQ:373,22/07/2014,22/07/2014,22,07,2014,2014-07-22,Kanaal Brussel-Schelde,LO Grimbergen 4a,152143.521,183945.43,baars,Baars,,"Perca fluviatilis Linnaeus, 1758","Kansaphyllum D.L. Baars, 1992", ,85,,4,NTMBZeekanaal,elektrische bevissing,NTMB,breuksteen
INBO:AQ:374,22/07/2014,22/07/2014,22,07,2014,2014-07-22,Kanaal Brussel-Schelde,LO Grimbergen 4a,152143.521,183945.43,baars,Baars,,"Perca fluviatilis Linnaeus, 1758","Kansaphyllum D.L. Baars, 1992", ,90,,1,NTMBZeekanaal,elektrische bevissing,NTMB,breuksteen
INBO:AQ:375,22/07/2014,22/07/2014,22,07,2014,2014-07-22,Kanaal Brussel-Schelde,LO Grimbergen 4a,152143.521,183945.43,baars,Baars,,"Perca fluviatilis Linnaeus, 1758","Kansaphyllum D.L. Baars, 1992", ,130,,1,NTMBZeekanaal,elektrische bevissing,NTMB,breuksteen
INBO:AQ:376,22/07/2014,22/07/2014,22,07,2014,2014-07-22,Kanaal Brussel-Schelde,LO Grimbergen 4a,152143.521,183945.43,baars,Baars,,"Perca fluviatilis Linnaeus, 1758","Kansaphyllum D.L. Baars, 1992", ,160,,1,NTMBZeekanaal,elektrische bevissing,NTMB,breuksteen
INBO:AQ:377,22/07/2014,22/07/2014,22,07,2014,2014-07-22,Kanaal Brussel-Schelde,LO Grimbergen 4a,151933.97,184364.531,baars,Baars,,"Perca fluviatilis Linnaeus, 1758","Kansaphyllum D.L. Baars, 1992", ,70,,2,NTMBZeekanaal,elektrische bevissing,NTMB,houtige begroeiing
INBO:AQ:378,22/07/2014,22/07/2014,22,07,2014,2014-07-22,Kanaal Brussel-Schelde,LO Grimbergen 4a,151933.97,184364.531,baars,Baars,,"Perca fluviatilis Linnaeus, 1758","Kansaphyllum D.L. Baars, 1992", ,80,,2,NTMBZeekanaal,elektrische bevissing,NTMB,houtige begroeiing
INBO:AQ:379,22/07/2014,22/07/2014,22,07,2014,2014-07-22,Kanaal Brussel-Schelde,LO Grimbergen 4a,151933.97,184364.531,baars,Baars,,"Perca fluviatilis Linnaeus, 1758","Kansaphyllum D.L. Baars, 1992", ,130,,1,NTMBZeekanaal,elektrische bevissing,NTMB,houtige begroeiing
INBO:AQ:380,23/07/2014,23/07/2014,23,07,2014,2014-07-23,Kanaal Brussel-Schelde,RO Wintam,145328.14,200090.246,baars,Baars,,"Perca fluviatilis Linnaeus, 1758","Kansaphyllum D.L. Baars, 1992", ,180,,1,NTMBZeekanaal,elektrische bevissing,NTMB,riet
INBO:AQ:381,23/07/2014,23/07/2014,23,07,2014,2014-07-23,Kanaal Brussel-Schelde,LO Lot,142617.889,161353.806,baars,Baars,,"Perca fluviatilis Linnaeus, 1758","Kansaphyllum D.L. Baars, 1992", ,110,,1,NTMBZeekanaal,elektrische bevissing,VVO,schanskorven
INBO:AQ:382,23/07/2014,23/07/2014,23,07,2014,2014-07-23,Kanaal Brussel-Schelde,LO Lot,142638.982,161424.946,baars,Baars,,"Perca fluviatilis Linnaeus, 1758","Kansaphyllum D.L. Baars, 1992", ,60,,1,NTMBZeekanaal,elektrische bevissing,NTMB,riet
INBO:AQ:383,23/07/2014,23/07/2014,23,07,2014,2014-07-23,Kanaal Brussel-Schelde,LO Lot,142638.982,161424.946,baars,Baars,,"Perca fluviatilis Linnaeus, 1758","Kansaphyllum D.L. Baars, 1992", ,70,,1,NTMBZeekanaal,elektrische bevissing,NTMB,riet
